budget,description,finishDays,project_tags,publishedDate,title
5000000,"saya perlu dibuatkan mini game mirip pokemon go. mekanik, objecktif, score system, mirip seperti pokemon go. nantinya akan ada beberapa ui. login signup ar battle scene (throw ball seperti pokemon, trus catch objek) objektif information ui final score kemungkinan akan ada fitur tambahan seperti location-based ar dan konek ke server jika fitur2 diatas sudah selesai. harga dan timeline bisa di nego, terimakasih. * jika tidak punya mac, gapapa biar saya yg test",14,"Game Programming,Unity 3D,Unreal Engine",03/05/2023 20:34:57 WIB,Buat Mini Game Ar Seperti Pokemon Go Pakai Unity/Unreal Untuk Android+Ios
6000000,"dear gan,  butuh bantuan untuk buat website penjurian responsive, dengan fitur sperti berikut :  form registrasi online utk peserta  payment gateway utk biaya lomba generate list peserta untuk masing2 kategori lomba  (grouping) master juri & level ( juri, head juri, chief juri) mapping juri ke @lomba master kriteria penilaian & bobot form penilaian yang di akses oleh juri by login kalkulasi penilaian dari masing2 juri penentuan pemenang dan kategori winner  (misal grade a nilai : 85-90 ), dst ada dashboard nya  cara daftar kirimkan portfolio infokan domisili skrg infokan, jika ada meeting dgn user di area jakarta, bisa / tidak di jam kerja infokan status kerjaan skrg : full time / full time freelance infokan kapan bisa mulai kerja",25,"CodeIgniter,Laravel Framework",03/05/2023 20:29:17 WIB,Buat Website Penjurian
5000000,"selamat siang saya butuh bantuan dalam pembuatan sistem virtual reality desain konstruksi mungkin gambarannya seperti video berikut  https://youtube.com/watch?v=vxq6gfqldxu jadi desainner membikinkan desain, kemudian customer bisa melihat desainnya melalui kacamata vr",30,"Architecture,Tutorial/Assistant,3D Rendering",14/05/2023 14:57:26 WIB,Butuh Bantuan Dalam Pembuatan Sistem Virtual Reality Desain Konstruksi
200000,"saya sudah buat analisi sentimen dgn kemana, tapi ada kendala dibagian akurasi evaluasi. pengukuran evaluasi nya menggunakan  sillhouett coefficient, hanya tinggal mengukur evaluasi aja. saya mengerjakan nya dirapid miner",3,Data Analysis,14/05/2023 14:46:06 WIB,Analisis Sentimen Dengan K Means
700000,"saya mengerjakan sistem manajemen event berbasis website, pakai native php versi 5.   butuh tambahan personil untuk:   - menambah fitur seperti: dashboard statistik, manajemen role, pengaturan, manajemen voucher,harga, manajemen langganan, metode pembayaran.    - cek fitur yg sdh ada, perbaiki tampilan/update.   yg sdh dibuat native php 5, theme botstrap metronic v5.",25,"Web Programming,PHP,Website",14/05/2023 14:39:15 WIB,Update Fitur Aplikasi Event Berbasis Website Php Native
500000,"saya membutuhkan aplikasi android sederhana, hanya berupa inputan data saja, nantinya bisa diinput dari backend dan dilihat dari aplikasi",7,"Java,Flutter",02/05/2023 05:24:55 WIB,Buat Aplikasi Android Sederhana
500000,"untuk orang yang bisa mengembalikan akun ig saya yang di hack.  akun tersebut adalah benar merupakan akun sah yang saya miliki, semua dampak hukum dari pemulihan akun tersebut adalah menjadi tanggungjawab saya sepenuhnya",7,Instagram,01/05/2023 14:21:40 WIB,Mengembalikan Ig Kena Hack
10000000,"pembuatan aplikasi mobile hampir mirip dan meyerupai dengan instagram dan tiktok. untuk desain dan tampilan ui lengkap sudah disediakan di figma. link nya sebagai berikut:  https://www.figma.com/file/hixsnd5o9nthdtt4xte0ql/coret-coretan?node-id=0%3a1&t=jdp5ow2erlotmsib-1 jika aplikasi sudah selesai, akan dilanjutkan dengan pengembangan kembali dengan menggunakan engineer yang sama",60,"Cross Platform Programming,Mobile Programming",01/05/2023 14:20:32 WIB,Pembuatan Aplikasi Mobile Mirip Instagram Dan Tiktok
300000,membuat desain background beserta content didalamnya sesuai dengan brief di file terlampir.,7,"Design Arts,Graphic Design,Adobe PhotoShop,3D Modelling",28/04/2023 13:07:36 WIB,Membuat Desain Background Beserta Contentnya
800000,"job description  : membuat brief konten dan caption untuk post, story & reels (1 minggu : 3-6 brief)  berdiskusi dengan klien untuk kepentingan isi caption & gaya caption menaruh hashtag yang sesuai dengan isi konten melakukan riset terkait dengan caption yang sesuai dengan gaya dari brand dan yang sedang trend sekarang sesuai dengan goals dari social media yang ingin dicapai saat itu kualifikasi : memiliki pengalaman membuat brief konten & menulis caption  (dalam bahasa indonesia & inggris)  di social media termasuk hashtag bertanggung jawab bisa dihubungi di jam kerja dan fast respon dapat menyelesaikan pekerjaan sesuai dengan due-date yang ditentukan helpful catatan : akan menangani untuk klien yang bergerak dalam bidang kesehatan holistik & pakaian syar'i muslimah, serta tas branded cv, portofolio dan nomor whatsapp aktif dikirimkan ke alamat email sevisi, maksimal  tanggal 7 mei 2023",30,"Social Media Marketing (SMM),Copywriter,Instagram,Social Media",28/04/2023 11:34:55 WIB,Copywriter
300000,akun tersebut merupakan akun  perusahaan namun harus reset password. dalam hal ini perusahaan lupa email pemulihan akun tersebut untuk reset password. perusahaan sudah menyutujui untuk lowongan pekerjaan ini.  akun tersebut adalah milik perusahaan yang didelegasikan kepada saya untuk diperbaiki.dan anda bersedia bertanggung jawab secarahukum apabila terjadi permasalahan terhadap akun tersebut.,3,"Email Support,Internet Marketing,Email Handling,Programming,Database Programming",26/04/2023 16:36:34 WIB,Recovery Akun
300000,"setup ci/cd untuk staging dan production environment, containeraize beberapa project go serta memastikan proses deployment berjalan secara otomatis",7,Golang,07/05/2023 16:00:10 WIB,Deploy Vps
50000,menulis 1 artikel minimal 500 kata dengan 1 backlink di kompasiana. hanya cocok untuk orang yang sudah punya akun dan pernah menulis.,7,Writing,25/04/2023 16:52:00 WIB,Menulis Di Kompasiana
700000,"dibutuhkan desain logo dan kemasan untuk sebuah brand makanan, warna brand dasarnya bisa dipakai hijau. untuk kemasan udah ada hanya di redesain. cek di attachmentkemasan pouch dan ditujukan kepada target market umur 25 keatas, produk berupa lauk untuk makan frozen. silahkan share portofolio juga, diutamakan yang bisa memberikan gambaran kasarnya.",7,"Design Arts,Graphic Design,Logo Design",12/05/2023 07:11:46 WIB,Desain Logo & Packaging Kemasan
1000000,saya membutuhkan game yang dibuat dengan unity detailnya saya lampirkan,7,Unity,16/05/2023 08:12:42 WIB,Butuh Game Unity
500000,"halo teman-teman freelancer semua, apa kabarnya? semoga baik-baik saja ya. project ini adalah repost dari project saya yang sebelumnya, karena belum menemukan penulis yang berkomitmen. maka dengan ini saya membuka lagi penawaran project sebagai penulis naskah untuk konten youtube. dengan kebutuhan: 1. panjang naskah 1000-1500 kata per konten. melakukan riset dari bbrp sumber.semakin dalam risetnya maka tentunya akan semakin menarik bagi audiens. sumber referensi  harus disertakan  di dalam naskah yg disetor...",15,"Writing,Microsoft Word,Content Writer",13/05/2023 11:29:38 WIB,Penulis Naskah Konten Youtube Dakwah Islami
3000000,"saya sedang mencari orang yang bisa oprek aplikasi android dari smart bottle yang sudah ada iotnya. kemudian dibuat ulang dan direkayasa aplikasi tersebut dalam aplikasi yang saya punya, sehingga iot pada smart bottle tersebut tetap aktif. ini link apk yang perlu dioprek : https://apkpure.com/ozmo-smart-bottle-and-water-app/com.grokinglab.android.ozmo/download",7,"Python,JavaScript,C/C++,Microcontroller",10/05/2023 06:27:54 WIB,Iot Untuk Smart Bottle
250000,halo.. saya butuh jasa untuk setting instagram ads dari fb. 1 iklan selama 7 hari. 1 iklan selama 7 hari. jadi total 14 hari budget iklan 50.000/ hari. silahkan bid ongkos jasa settingnya ya.. terimakasih,14,"Facebook,Instagram",17/05/2023 12:51:14 WIB,Instagram Ads
200000,"hi, saya ada image editing apps menggunakan imagemagick. ada mau optimize dan tambah product atau features di apps itu.  hubungi kalo memang udah ada pengalaman di imagemagick.",14,"JavaScript,PHP",17/05/2023 11:34:08 WIB,Imagemagick/Php/Javascript Expert
500000,"saya mencari orang yang paham membuat analisa keuangan dan  laporan keuangan.. \ 1.berpengalaman 2,lokasi jabodetabek",7,"Business Consultation,Tax Consultation,Legal Consultation,Content Management System (CMS),Microcontroller,Consultancy,Content Writer,Netop Remote Control",17/05/2023 10:08:13 WIB,Analisa Keuangan Bisnis
250000,"halo sobat project, apa kabar, bisa bantu tidak buatkan logo utk aplikasi rental mobil, namanya nanti saya japri , logo nya tidak ribet, simpel dan mengena, kalau dari jarak jauh, udah yakin itu aplikasi rental mobil.  ilustrasinya logo mengenai share lokasi , ada unsur mbl nya dan ada unsur transportasinya,  tidak pernah terpublikasi sebelumnya. untuk logo utama apk cust warna logo bebas, kalau bisa unsur warna lampu lalu lintas yg domain, dan untuk apk mitra cukup 1 warna saja,  kalau bisa ada unsur hexagon nya jg (semisal bisa) format file ...",7,"Logo Design,Adobe PhotoShop,Adobe Illustrator",19/05/2023 07:29:26 WIB,Logo Aplikasi Rental / Transportasi
500000,"(  mohon yang tidak ada pengalaman menulis artikel q1-4  tidak melamar)    dibutuhkan freelance untuk menulis artikel penelitian berbahasa inggris dengan lingkup topik seputar pendidikan, pengetahuan umum, penulis akan diminta menulis dengan topik pengetahuan umum, literature review      total artikel 5 buah          jumlah kata +/- 3500 kata per artikel. *jumlah referensi min 30         pernah menulis atau paham menulis di dalam jurnal ter index scopus         artikel kredibel, informatif dan valid...",7,"Statistical Analysis,Writing,Reviews,Analysis,Data Analysis,Proofreading",18/05/2023 22:20:12 WIB,Penulis Artikel Jurnal Ter Index Scopus/Wos/Sinta ( Khusu Yang Berpengalaman)
1500000,halo para freelancer berbakat. saya memiliki project untuk membuat software untuk dapat membuat sebuah buku ataupun merewrite sebuah buku dari awal sampai akhir. pada saat ini saya membuat buku dengan chat gpt secara manual dan mau mengotomatiskan pekerjaan ini sehingga saya hanya perlu memberikan beberapa input/prompt ataupun mengupload file word untuk kemudian chat gpt yang akan menyelesaikannya. saya telah memiliki alur kerjanya yang dapat di lihat pada folder attachment. dan untuk pekerjaan ini saya harap softwarenya dapat berfungsi di windows...,7,"Android,JavaScript,Windows Programming,.NET Framework,OpenGL",18/05/2023 21:59:34 WIB,Pembuatan Software Pembuat/Rewrite Buku Dengan Chat Gpt
5000000,"yang dibutuhkan 2 sensor sensor a (untuk deteksi jenis kendaraan)   ada 2 opsi  sensor opsi 1 sensor mengetahui kendaraan lewat apakah mobil, motor dan truck, berdasarkan hasil capture/foto camera menggunakan ai, apabila truk, akan kirim perintah ke sensor b   sensor opsi 2 sensor ketinggian, apabila kendaraan yang lewat tinggi sudah sesuai sensor, maka akan kirim perintah ke sensor b   sensor b (untuk deteksi muatan) sensor b ini menggunakan camera, apabila ada perintah dari sensor a, sensor b akan menfoto/capture muatan yg dibawa oleh truk, dengan ai, akan bisa di baca apakah yg dibawa jenis nya batu, tanah, pasir dll lalu hasil foto dan hasil ai dikirim datanya ke dashboard, untuk di rekap berapa banyak kendaraan truk yang membawa tanah, pasir dan batu dalam 1 hari catatan :  1...",20,"MySQL,Arduino,Java,PHP,C/C++,Java Native,Phyton",04/05/2023 18:41:50 WIB,Dibutuhkan Pembuatan Sensor Arduino & Ai Berbasis Camera
2000000,dibutuhkan programmer berpengalaman untuk back end dengan golang  dan framework go fiber.,15,"PostgreSQL,Golang",04/05/2023 16:33:20 WIB,Progrmer Be Golang Dengan Framework Go Fiber
500000,halo! kami membutuhkan 10 image vector tematik berformat eps. wajib original dan belum pernah publish dimanapun. temanya akan ditentukan kemudian.,7,"CorelDRAW,Adobe PhotoShop,Adobe Illustrator,Grafis Vektor",03/05/2023 16:08:05 WIB,Desain 10 Image Vector Tematik
300000,"dibutuhkan sebuah logo dengan brand guidelinenya, logo harus memiliki filosofi, berikan portfolio terbaikmu saat bid. tanpa portfolio tidak akan direspon",7,"CorelDRAW,Graphic Design,Logo Design,Adobe PhotoShop,Adobe Illustrator",02/05/2023 15:37:17 WIB,Logo & Brand Guideline
300000,"saya membutuhkan developer wordpress yg bisa memodifikasi plugin payment gateway dan mengerti api qris dinamis pada web woocommerce (khususnya api bri) paymet gateway tidak mau menggunakan pihak ketiga seperti midtrans, ipaymu, dll kondisi sekarang sudah terpasang plugin qr payment dengan qris statis dengan 2 step, yaitu step pertama user scan qris pada tampilan pembayaran lalu memasukkan nominal yang tertera pada kolom checkout, lalu step kedua user diminta upload screenshot bukti hasil pembayaran dengan qris, lalu selesai yang diinginkan adalah pada saat checkout user memilih pembayaran dengan qr payment lalu akan tampil qris dan user tinggal scan qris tersebut tanpa harus input kembali nominal yang di checkout (qris dinamis) lalu selesai, jadi hanya butuh 1 step saja, user tidak perlu upload screenshot bukti transaksi qris...",3,"Programming,Web Programming,PHP,Wordpress,HTML,CSS,WooCommerce,API Gateway",03/05/2023 12:22:36 WIB,Modifikasi Plugin Payment Gateway Woocommerce Dan Integrasi Api Qris Dinamis Untuk Pilihan Pembayaran
1000000,"saya ada template wallet backend laravel mau di rubah ke node js dengan aplikasi flutter, silahkan bid jika sudah terbiasa dengan wallet aplikasi dan top up via visa, sertakan wa",7,"NodeJS,Flutter",14/05/2023 07:09:47 WIB,Rubah Sistem Wallet Dari Laravel Ke Node Js
600000,"dibutuhkan jasa pelaporan spt, laporan keuangan sudah selesai dan dibutuhkan untuk melaporkan spt untuk badan usaha",7,"Tax Consultation,Accounting,Financial Planning",13/05/2023 21:33:33 WIB,Pelaporan Spt Badan Usaha
500000,dicari konten kreator atau video editor untuk membuat 5 video reels kebaya / dress durasi maksimal 1 menit per video lokasi surabaya barat.,30,"Photography,Video Editing",13/05/2023 20:37:19 WIB,Konten Video Reels
250000,"saya mempunyai router modem epon zte f477v2 versi firmware china (bahasa cina) dan versi firmware bahasa inggris, nah saya ingin firmware dari versi bahasa inggris bisa di backup atau cloning supaya bisa untuk upgrade yang versi cina menjadi bahasa inggris untuk kerjanya nanti bisa via remote saya sediakan remote via any desk untuk megakses ip perangkat lokalnya, nah setelah itu silahkan untuk mengerjakannya untuk detailnya lagi nanti bisa ditanyakan kalau sudah sepakat",4,"Technical Support,Software Installation,Firmware Programming,Networking,Network Security",01/05/2023 10:10:40 WIB,Cloning Firmware Modem Zte F477V2 Epon
100000,aku mau belajar buat artikel untuk kerjaan sampingan sebagai penulis artikel diproject.co.id atau diplatform lainnya   jadi aku butuh mentor yang paham cara kerjanya penulis artikel di project.co.id dan bisa ngarahin cara kerja diproject.co.id   sebutkan juga kenapa aku harus milih kamu,7,"Search Engine Optimization (SEO),Writing,Copywriter,Content Writer",01/05/2023 06:27:45 WIB,Cari Mentor Buat Ngarahin Cara Buat Artikel
500000,"deskripsi pekerjaan:kami mencari seorang programmer yang handal untuk bergabung dengan tim kami dalam membuat bot check-in untuk program branding. programmer yang sukses akan bertanggung jawab untuk membangun bot telegram yang akan melakukan check-in harian pada klien kami yang terdaftar di program branding kami.membuat bot di telegram dan diperuntukan untuk check-in branding sticker di mobil, motor, dll tanggung jawab: merancang dan mengembangkan bot telegram untuk melakukan check-in harian untuk program branding...",3,"Programming,Python,ActionScript,SQL Server",30/04/2023 13:26:37 WIB,Dibutuhkan Programmer Untuk Membuat Bot Check-In Branding
100001,"saya membutuhkan dokumen persyaratan pembuatan domain .co,id proses bebas worker yang order dan saya bayar invoice nya lalu worker menyerahkan dokumen yang dibutuhkan atau saya sudah orderkan dulu, worker tinggal menyerahkan dokumen yang dibtuhkan silahkan tinggal kan telegram agar bisa saya hubungi",7,Legal Consultation,28/04/2023 10:38:45 WIB,Pembuatan Domain .Co.Id (Berkas Saja)
500000,"halo, saya butuh aplikasi sederhana berbasis web untuk keperluan tracking untuk lab kecil. aplikasi berfungsi untuk mengetahui hasil dari pemeriksaan dan status hasil itu (sudah selesai dan bisa diambil atau sedang dalam proses pengecekan). kurang lebih seperti tracking resi jne, tiki, dsb. selain itu pengunjung website bisa memberikan rating atau komentar. kalau ada yang bisa silahkan kasih penawaran harga, contoh aplikasi serupa dan waktu pengerjaan. thank you.",7,"Programming,Database Programming,Web Programming,Desktop Programming",28/04/2023 09:48:16 WIB,Web Based Application Tracking
150000,"hallo freelancer, mau minta tolong saya ada pekerjaan merubah warna peta , baik icon ataupun peta nya di kondisi tertentu, untuk library nya menggunakan amchart bahasa yg digunakan php + js, aplikasi saat ini sudah publish, jadi sifatnya mengcustom yg sudah ada, cara kerjanya nanti menggunakan git di invite",3,"JavaScript,PHP,CodeIgniter",28/04/2023 09:42:39 WIB,Merubah Warna Pada Peta Amchart
1000000,"saya ada aplikasi sistem ppob dan toko online dengan backend laravel dan android flutter, mau di rubah node js dari awalnya laravel untuk loading yang lebih realtime, silahkan cantumkan wa dan portofolionya",3,"Laravel Framework,NodeJS",26/04/2023 13:38:48 WIB,Merubah Dari Laravel Ke Node Js
1000000,"saya sedang butuh aplikasi android untuk memonitoring aktivitas di handphone anak. requirement - bisa mengaccess camera remotely (at least view camera) - keylogger - bisa remote view screen - bisa remote access mic (one way dengarin suara) - tanpa rooting - setelah config / install, icon di hide dari handphone / di mask dengan password status : - saya punya akses ke hp target  - semua permission bisa saya accept. tapi tidak boleh rooting. preferensi menggunakan flutter, tapi boleh di buat menggunakan apa saja",7,"Android,Android studio,Flutter",26/04/2023 13:28:37 WIB,Butuh Android Apps Monitoring Menggunakan Flutter
500000,butuh orang yang bisa bikin facebook group scrapper/fetcher menggunakan nodejs requirement - scrap postingan + komentar + nama + timestamp dari suatu group di facebook (public maupun private group) - hasil scrap berupa json boleh scrap manual ataupun pakai api,7,"NodeJS,Web Scrapping,Facebook",26/04/2023 13:26:06 WIB,Butuh Develop Untuk Facebook Group Scrapper
150000,target responden karyawan yang bekerja di pt.  butuh 100 responden. diharapkan yang mengiri kuisioner tidak jawab ngasal. butuh segera!!,7,"Data Entry,Microsoft Excel,Analysis",07/05/2023 12:31:08 WIB,Sebar Kuisioner Penelitian
2500000,"saya sedang mencari script / website buat toko saya fitur: login & register edit profile deposit saldo melalui bank ( cek otomatis/manual) integrasi payment gateway ( duitku/ipaymu/atau lainnya & bisa dipakai multi pgnya ) akun member & reseller upgrade reseller topup tanpa login & login potong saldo otomatis setelah topup game id checker refund transaksi berita harian voucher game history transaksi invoice transaksi open koneksi api/otomax/dll halaman admin : seperti history transaksi/deposit , pembelian harian / bulanan , dll jika ada fitur lainnya boleh provider  kiosgamer smile one ( di utamakan yang direct langsung ) highs domino unipin brl unipin my unipin indonesia razer gold gamepoint ( diutamakan yang direct langsung ) (untuk 7 ini apakah worker memakai apigames atau bot sendiri ? ) digiflazz buyer digiflazz seller untuk contoh website sudah banyak ya !!! diutamakan yang menggunakan laravel saya mendapatkan full source code ? berapa lama pengerjaan project ini ? bagaimana jika terjadi error / bug pada script ? - silahkan berikan demo dari website topup gamenya agar saya tau tampilannya bagaimana - berikan nomor yang bisa dihubungi melalui whatsapp admin note: dilarang mencantumkan ataupun meminta kontak pribadi pada deskripsi project ataupun pada link yang anda cantumkan...",7,"Web Programming,Laravel Framework",07/05/2023 10:30:50 WIB,Pembuatan Website Topup Game
150000,"membuat lapor kondisi ekonomi bilateral pada q1 2023. yang berisikan data perdagangan, pertumbuhan, kondisi makro dan mikro ekonomi. dalam bahasa inggris. diutamakan yang biasa menulis topik ekonomi dalam bahasa inggris. 4-5 halaman maksimal. tolong lampirkan portfolio",3,"Business Analysis,Risk Analysis,Market Research,Presentations,Writing,Analysis,Quantitative Analysis,Copywriter,Content Writer",12/05/2023 07:02:10 WIB,Membuat Laporan Kondisi Bilateral Ekonomi
2000000,"saat ini kami memerlukan aplikasi  android seperti wartel dengan menggunakan video call whatsapp. alur singkat aplikasinya seperti ini: konsumen memesan jumlah saldo ke kasir berupa kupon (qr-code)  aplikasi men-scan kupon qr-code tersebut untuk identifikasi jumlah saldo. setelah terverifikasi konsumen memasukan nomor telepon kemudian secara otomatis aplikasi wartel membuka whatsapp videocall (android intent whatsapp), call gsm, call whatsapp. setelah jumlah saldo habis, maka aplikasi wartel lgs menutup videocall...",30,"Java,Mobile Programming,Android",15/05/2023 22:06:52 WIB,"Aplikasi Android Wartel Dengan Memanfaatkan Whatsapp Videocall, Call Gsm, Whatsapp Call"
300000,"dear freelancer  bantu saya buatkan gant chart sperti gambar yang saya lampirkan  spesifikasi dengan html, css, dan js silahkan tawarkan harga terbaik",7,"JavaScript,HTML,CSS",15/05/2023 21:34:32 WIB,Gant Chart Html Css Js
300000,"selamat malam saya butuh orang untuk tempat saya bertanya-tanya terkait bootstrap khususnya segala hal terkait urusan estetika tampilan web misal bagaimana caranya agar ukuran gambar tidak kelihatan gepeng, bagaimana caranya membuat tampilan megamenu yang sesuai keinginan, dan masih banyak lainnya terkait urusan estetika tampilan web batas projek 1 bulan",30,"Tutorial/Assistant,Bootstrap",10/05/2023 06:27:27 WIB,Butuh Bantuan Terkait Bootstrap
3500000,"dibutuhkan developer untuk pembuatan website marketplace produk virtual detail: ada info seller information dibagian detail produknya payment gateway pakai eksternal (midtrans, xendit, atau yang lainnya) contoh: p-st*re.net, digital0ka.net silahkan kirimkan portofolio kalian",30,"Website,Web Design,Website Building",09/05/2023 22:26:53 WIB,Jasa Pembuatan Website Marketplace Produk Virtual
3000000,need pembuatan website wordrpess dengan fitur sebagai berikut profile & landing page event registration (custom) & payment news / berita shop / merchandise page - integrasi juga dengan payment gateway xendit multi language page (indo english) information page = total halaman sekitar 40 - 50 halaman referensi web : https://www.nyrr.org/tcsnycmarathon refeerensi web : https://preview.themeforest.net/item/converx-conference-single-event-theme/full_screen_preview/32232700 boleh menggunakan theme & plugin wordpress...,7,Wordpress,17/05/2023 07:08:08 WIB,Need Website Event Dan Ecommerce Wordpress
1000000,dicari konten kreator atau videografer/editor untuk membuat : - 1 video short/reels durasi pendek ke menengah (bisa di sesuaikan dengan konsep alur video) - mengikuti sesuai konsep yang sdh di sediakan (terlampir) - menyediakan suara voice over waktu pengerjaan : 7-14 hari,14,"Video Editing,Video Production",18/05/2023 17:47:50 WIB,Membuat Konten Video Otomotif
750000,"dibutuhkan minimal seorang sarjana yang berpengalaman menggunakan aplikasi nvivo untuk mengolah data kualitatif hasil dari wawancara dengan informan penelitian, mohon dilengkapi dengan cv terupdate dan pengalaman yang relevan serta contoh dari hasil pekerjaan nvivo yang telah dikerjakan sebelumnya. worker akan dipilih berdasarkan contoh hasil kerja yang menurut kami sesuai dengan kebutuhan. detail pekerjaan: 1 project pengolahan penelitian terhadap 1 program pelatihan menggunakan model cipp di nvivo, pelerjaan dianggap selesai apabila telah diolah menggunakan nvivo dan menghasilkan data olahan...",3,"Analysis,Quantitative Analysis",18/05/2023 17:46:59 WIB,Pengolahan Data Kualitatif Dengan Nvivo 12
2500000,saya disini membutuhkan developer fullstack.  aplikasi ini telah didesain menggunakan figma. aplikasi yg akan dibuat berbasis flutter/dart. server yg akan digunakan adalah aws.  mail server yg akan digunakan aws sns/ses. diutamakan yang sudah pernah atau berpengalaman dengan aws. nb : nda dibutuhkan untuk project ini. terima kasih.,30,"API Gateway,Flutter,AWS Cloud,Amazon Service Cloud",18/05/2023 14:42:09 WIB,Fullstack Aplikasi Absensi/Presensi
2500000,"dibutuhkan segera programmer android untuk pengembangan dan perbaikan  aplikasi pos yg sdh berjalan, pengembangan aplikasi dibawah ini detail terlampir silahkan di bid terima kasih",7,"MySQL,Java,Android,Java Native,Android studio",04/05/2023 16:33:11 WIB,Dibutuhkan Programmer Android
5000000,"lokasi di jakarta, installasi dan migrasi mail usernya 50 client. diskusi paket kerjanya dl",7,"Email Handling,Networking,Windows Server,Network Security,SQL Server",04/05/2023 15:50:17 WIB,Instalasi Dan Migrasi Mail Server Zimbra
1000000,"dicari jasa membuat shopify : 1. membuat design template 2. integrasi dengan facebook & instagram shop ( post produk di shopify- auto post di igshop/facebookshop ) 3. integrasi payment gateaway 4. integrasi ke jubelio (saya memakai jubelio , integrasi orderan masuk ke omnichanel) 5. pengiriman (ongkir) 6. pemakaian shopify 7. seo",14,"Web Research,Web Programming,Website,Web Design,Website Building,Website Templates,Web Scrapping",04/05/2023 15:41:45 WIB,Dicari Jasa Membuat Website Shopify
