budget,description,finishDays,project_tags,publishedDate,title
250000,menulis 1 artikel review mengenai apartemen di mana anda tinggal dan membuat 1 video singkat berisi fasilitas-fasilitas apartemennya.,7,Writing,23/04/2023 20:27:17 WIB,Penulis Yang Tinggal Di Apartemen Jakarta
350000,pekerjaan  membuat artikel di salah satu media ternama menggunakan referensi materi dari kami hingga  terposting / dipublish   di media tersebut memposting di  media online / blog  ternama hingga terbit seperti liputan6 tribunnews detik cnn kompas aktual channelindonesia jabodetabek infowarganet livejournal dll membuat artikel berkualitas (bukan asal copy paste) total artikel : 1 banyak kata :  bebas (sesuai pedoman minimal standarisasi membuat 1 artikel) niche / tema / topik game online / dunia it deadline : 7 days lampirkan link artikel / portfolio yg telah kalian buat di media andalan kalian untuk menjadi bahan pertimbangan saya dalam memilih worker terima kasih projects...,7,"Blog,Blogspot,Content Management System (CMS),Copywriter,Content Writer",24/04/2023 17:27:08 WIB,Membuat Artikel Di Media Online
200000,"hi saya ada 12 video rata-rata 1 menit untuk di upload ke tiktok butuh freelancer untuk bisa bantu editing sebaik mungkin harapan hasil editingnya seperti akun berikut : https://www.tiktok.com/@fadiladitya_e https://www.tiktok.com/@felicia.tjiasaka/video/7223726230338538779?is_from_webapp=1&sender_device=pc&web_id=7221384834656093697 https://www.tiktok.com/@raymondchins/video/7234507981692488966?is_from_webapp=1&sender_device=pc&web_id=7221384834656093697 bebas mau pakai aplikasi apapun, yg penting hasil memuaskan silahkan atach hasil project video anda sebelumnya",7,"Social Media Marketing (SMM),Adobe Illustrator,Multimedia,Video Editing,Video Production,Adobe After Effects,Video Animation,Social Media",20/05/2023 21:50:31 WIB,Editing 12 Shortt Video Untuk Konten Tiktok
1000000,yang punya akun canva creator element atau canva creator template yang tidak terawat dan mau dijual biar saya rawat,7,"Design Arts,Graphic Design,Logo Design,Canva",03/05/2023 08:35:54 WIB,Cari Akun Canva Creator Element Atau Template
150000,sedang mencari jasa upload aplikasi ke app store,7,iPhone/iOS,20/05/2023 17:42:39 WIB,Cari Jasa Upload Aplikasi Ke App Store
200000,"silahkan disebutan pada bids apakah sudah pernah membuat tulisan bertemakan zodiak dan memiliki pemahaman maupun ketertarikan dalam membahas zodiak sebagai kelebihan dari penulis.  saya membutuhkan tulisan zodaik sebanyak 10 tulisan sebanyak 400 kata tulisan santai serta mudah dibaca dan dimengerti. tidak menerima copas atau spin, jika ketawan project dibatalkan, wajib unique 100%. budget rp200.000 waktu pengerjaan 10-14 hari. contohnya: zodiac aries hari ini aries lagi kurang percaya diri...",10,Writing,20/05/2023 17:42:30 WIB,Saya Membutuhkan Penulis Untuk Artikel Zodiac
150000,saya membutuhkan jasa penyebaran responden dengan target 30 responden . kriterianya pernah menggunakan e-filing dan berdomisili di sleman (diy) . kriteria lebih lanjut bisa lihat di gambar terlampir. saya menggunakan survey monkey sebagai media kuesioner. mohon cari responden asli karena akan saya cek. terima kasih.,3,"Data Entry,Quesioner,Responden",20/05/2023 16:34:01 WIB,Penyebaran Kuesioner Sleman
250000,"halo worker, saya butuh bantuan untuk bbrp hal: 1. proses upload gambar 2. halaman mapping benefit dengan level membership misal level bronze ada benefit extra coin, etc 3. butuh dibuatkan push notif saat update status order.  push notif ke firebase ya karena akan digunakan untuk pn ke mobile app. saat ini bahasa yg digunakan php pdo  pengerjaan remote menggunakan team viewer. detail push notif akan saya infokan. mohon tanyakan jika ada yg kurang jelas",7,"PHP,CodeIgniter",20/05/2023 16:33:49 WIB,Dicari Yg Bisa Bantu Di Php
2000000,"dicari untuk dibeli, akun adsense tahun 2013 - 2015 untuk website, sudah pin, pin + po. tulis spek: ✅ adsense untuk blog/website ✅ email utama ✅ iklan tayang 100% ✅ infokan sudah po/pin berapa kali ✅ apakah ada domain yg terhubung mohon kirimkan screenshot adsense yg berhubungan dengan spek di atas. terimakasih",70,"Web Programming,Website,Blog,Blogspot,Wordpress,Web Design,Wordpress Templates,Google Adsense,Google Adwords,Google Admob",19/05/2023 13:36:07 WIB,Dibeli Akun Adsense Tahun 2013 - 2015 Untuk Website
750000,"saya membutuhkan game dengan unity sederhana hanya game pembelajaran perhitungan tambah, pengurangan, pembagian, dan perkalian, saya sudah memiliki assetnya",5,Unity,20/05/2023 13:16:28 WIB,Butuh Game Unity
1000000,"halo teman-teman, saya sedang ada project untuk convert aplikasi desktop (vb) menjadi webapi (c#). yang paham vb silahkan nge bid, kalau yg belum pernah atau mau coba-coba lebih baik jangan. karena timeline ketat. detailnya saya jelaskan pada meeting.",7,VB.Net,18/05/2023 12:17:11 WIB,Convert Vb Jadi Webapi C#
100001,"tugas sejarah nkri ""menganalisis kebijakan indonesia bagi pengungsi ilegal / imigran asing (contoh : rohingya) berdasarkan sila kedua pancasila"" ketentuan : font 12, spasi 1.5, dan maksimal 2 halaman kirimkan hasil penulisan anda sebelumnya, agar saya bisa menilai, tidak copy paste, murni tulisan sendiri dan tidak menggunakan chatgpt, lolos dari ulasan ulasan menjiplak dll",1,Writing,20/05/2023 13:15:48 WIB,"""Menganalisis Kebijakan Indonesia Bagi Pengungsi Ilegal / Imigran Asing (Contoh : Rohingya) Berdasarkan Sila Kedua Pancasila"" Ketentuan : Font 12, Spasi 1.5, Dan Maksimal 2 Halaman"
1000000,"halo, kami ingin membuat website: bisa menampilkan gallery gambar memiliki fitur multi admin memungkinkan untuk dikelola sendiri  dua bahasa mobile friendly seo friendly  jika tertarik, mohon mengirimkan penawaran + contoh website yang sudah dibuat. terima kasih.",14,"Website,Website Building",15/05/2023 13:24:23 WIB,Pembuatan Website Company Profile
5000000,kami membutuhkan scraper ( api ) untuk membuat api dana dengan fungsi : mengambil mutasi dana transfer antar nomor hp transfer ke rek bank mohon diingat ini tidak memakai api resmi ya. terima kasih,5,"Android,Web Scrapping",08/05/2023 22:08:26 WIB,Dibutuhkan Scraper Unofficial Aplikasi Dana
500000,"dibutuhkan jasa untuk membuat fitur pembelian pada ms acces. dapat membuat desain tampilan, paham mengenai query & vba ms acces, serta unsur ms acces lainnya. desain alur pembelian sudah tersedia. ps : tolong sertakan portofolio selengkap-lengkap.  terimakasih",14,Microsoft Access,18/05/2023 08:48:51 WIB,Ms Access
500000,"hi saya membuka lowongan untuk penulis lepas yang mengerti menulis artikel ramah seo. diutamakan penulis yang berpengalaman dan hasil tulisannya berada di halaman pertama pencarian google. jadi sebelum anda bid, beritahukan ke saya hasil tulisan anda yang berada di halaman pertama google. dan juga berikan keywordnya. ( jangan chat ya ) yang saya butuhkan 10 artikel. temanya sesuai dengan apa yang dikuasai penulis. silahkan bid dengan harga yang pantas.",30,"Search Engine Optimization (SEO),Writing",18/05/2023 08:48:28 WIB,Butuh 10 Artikel Ramah Seo
1500000,saya memerlukan developer yg sdh pernah m3mbuat aplikasi webserver utk gpa tracking adapun fitur yg diperlukan minimal aeperti yg sdh ada wanway tracksolid dll terimakasih,30,"MySQL,HTML,JSON,Phyton",20/05/2023 13:15:07 WIB,Pembuatan Webservice Gps Tracking
500000,"hi, kami sedang mencari freelance writer yang bisa menggunakanai untuk membuat artikel yang unik, tidak terdeteksi plagiarism maupundeteksi ai. untuk project ini kami memerlukan 50 artikel antara 300-500kata per artikel. adapun topik yang kami cari: pendidikannonformal, kesehatan, sosial, kemanusiaan, kesehatan, pembangunan,penggalangan dana (donasi), kebencanaan, pelestarian lingkungan,pemberdayaan ekonomi, perubahan iklim, sains & teknologi, energi,pemberdayaan anak-anak, pemberdayaan perempuan, panti asuhan, komunitasmasyarakat, pelestarian budaya, pemberdayaan hak asasi manusia, bantuanhukum, organisasi relawan, pertanian, aktivitas pemuda, aktivitas risetsains, peningkatan kondisi pekerja, serikat pekerja, komunitas olahraga,pencegahan kriminalitas, asosiasi pemilik rumah, pendidikan pemilu,pengawasan pemilu, advokasi...",7,"Writing,Copywriter,Content Writer,Artificial Intelligence",20/05/2023 12:51:19 WIB,Penulisan Artikel Bahasa Inggris 300-500 Kata Menggunakan Ai
450000,"pembuatan modul laravel, login tidak perlu laravel yang digunakan versi 9 pekerjaan remote, waktu maksimal 2 hari sejak deal (tidak bisa mundur) modul laravel menggunakan paket (nwidart/laravel-modules) dan pdf (barryvdh/laravel-dompdf)  untuk fitur cetakan buku induk (2 lembar) & 8335 1 lembar database sudah disediakan, models juga sudah disediakan untuk ui nanti didiskusikan, buat gambaran hanya 1 halaman saja berupa list dan button cetakan modal (popup) yang menampilkan cetakan *) maaf  budget terbatas, boleh bid lebih atau kurang dari harga yang ditawarkan",2,Laravel Framework,20/05/2023 06:49:04 WIB,Membuat Modul Berupa Cetakan Pdf Dengan Laravel
2100000,"hi workers! urgent!. to d point saya mencari jasa pembuatan website laundry yang mana nanti nya customer bisa cek status langsung di website.  dengan ketentuan. 1. domain menggunakan .com 2. hosting personal 3. custom html css 4. page admin untuk ubah status laundry silahkan bid dengan menyertakan rincian biaya, lampirkan portofolio, sertakan nomor telp/email yang bisa dihubungi. trimakasih. contoh file rincian biaya saya berikan di bawah.",15,"MySQL,Website,Website Building,HTML,CSS,Bootstrap",15/05/2023 11:39:11 WIB,Pembuatan Website Laundry
500000,"dicari yang bisa membuat dashboard autocekmutasi e-wallet (ovo, gopay, dana) + pulsa (tsel, xl, tri) untuk keperluan toko online.",3,"Web Design,Desktop Programming,API Gateway",15/05/2023 11:23:16 WIB,"Cek Mutasi E-Wallet ( Ovo, Dana, Go-Pay ) & Pulsa ( Tsel, Xl,Tri ) )"
3000000,dibutuhkan programmer aplikasi berbasis android,30,Android,08/05/2023 19:41:33 WIB,"Pembuatan Aplikasi Berbasis Android Untuk Caleg : Manajemen Relawan, Saksi, Data Perolehan Suara, Data Sebaran Tps, Data Dpt Berdasarkan Dapil Dan System Kawal C1"
1000000,"membuat landing page responsif untuk kuis trivia berhadiah, terdiri dari pekerjaan: - mengerjakan desain landing page, desain harus menarik agar orang mau mengikuti karna akan dipromosikan di situs-situs ternama. - mengerjakan front end. - harap melampirkan sample pekerjaan desain yg pernah dikerjakan. terima kasih,",7,Web Design,08/05/2023 16:47:07 WIB,Pengerjaan Landing Page
500000,dibutuhkan freelancer untuk membuat 1 ppt ip project dengan penjelasan sebagai berikut : 1. terbiasa membuat company profile 2. bisa membuat animasi 3. kreatif 4 materi sudah disiapkan hanya tinggal diolah saja.,14,"Design Arts,Illustration",08/05/2023 16:45:02 WIB,Pembuatan Ppt Ip Project
500000,bismillah.. saya membutuhkan worker yang mengerti open cart 3+ jurnal 3 .. untuk melakukan custom template dan modul .. membuat custom pada detial produk,7,"PHP,OpenCart,HTML",13/05/2023 13:46:47 WIB,Cusotm Modul Dan Template Open Cart + Jurnal
1000000,dibutuhkan seseorang yang dapat saya beri kuasa unuk melakukan pelaporan lkpm. dan problem solver berkaitan kendala birokrasi perizinan.          open diskusi terlebih dahulu dan negotiable.,14,"Administrative Support,Accounting,Writing,Administration",15/05/2023 17:28:31 WIB,Laporan Lkpm
1500000,"hallo,  saya ingin membuat website usaha seperti pada contoh. dimana ada fitur berikut : bisa tracking proses pengerjaan ijin yang bervarian.  terhubung dengan whatsapp untuk page nya tidak sebanyak seperti pada website contoh. karena masih baru merintis. terima kasih",7,"Web Programming,JavaScript,PHP,Website,Wordpress,Web Design,Website Building,HTML",10/05/2023 20:20:25 WIB,Webiste Landing Page
2500000,"kondisi, saya memiliki online shop dan salah satu payment ny menggunakan dana (https://www.dana.id/). saat ini saya mempunya 3 akun dana yang masing2 beda nama dan beda hp. ingin membuat aplikasi web based yang mempunyai fungsi : bisa menampilkan mutasi transaksi dari masing2 akun dana bisa melihat saldo dari masing2 akun dana untuk selebihnya seperti transfer atau fitur lain nya tetep menggunakan hp.",7,"Web Programming,JavaScript,PHP,Website,Web Design,Website Building,HTML,Web Scrapping,ReactJS,React Native",18/05/2023 08:47:44 WIB,Pembuatan Aplikasi Cek Mutasi Aplikasi Emoney (Dana)
400000,dear copywriting saya membutuhkan jasa penulis artikel seo berpengalaman lebih dari 3 tahun untuk menulis sekaligus memposting di website kami . job deskripsi 1. membuat keyword rencana yg akan dibuat artikelnya dengan trafic yg lumayan banyak dan sedikit pesaingnya hntuk kata kunci yg ditarget 2. dibuat sebanyak 30 artikel dimana 1 arrikelnya terdiri dari minimal 700 kata  3.. artikel harus lolos copyscape dengan memberikan bukti kesaya . 4. penulis aerikel harus membuat dengan gaya seinformatif mungkin 5...,30,Copywriter,18/05/2023 07:42:22 WIB,Dibutuhkan Jasa Buat Kontent Seo Digitial Printing
150000,saya sudah punya design figma nya. saya butuh orang untuk ngubah design figma saya ke html yang rapi yang presisi sama seperti design figma saya. contohnya seperti di lampiran. saya butuh selesai dalam waktu 7 hari.,7,"JavaScript,HTML,CSS",20/05/2023 11:55:36 WIB,Mengubah Design Figma Ke Html
500000,"hi, kami sedang mencari freelance writer yang bisa menggunakan ai untuk membuat artikel yang unik, tidak terdeteksi plagiarism maupun deteksi ai. untuk project ini kami memerlukan 50 artikel antara 300-500 kata per artikel. adapun topik yang kami cari: pendidikan nonformal, kesehatan, sosial, kemanusiaan, kesehatan, pembangunan, penggalangan dana (donasi), kebencanaan, pelestarian lingkungan, pemberdayaan ekonomi, perubahan iklim, sains & teknologi, energi, pemberdayaan anak-anak, pemberdayaan perempuan, panti asuhan, komunitas masyarakat, pelestarian budaya, pemberdayaan hak asasi manusia, bantuan hukum, organisasi relawan, pertanian, aktivitas pemuda, aktivitas riset sains, peningkatan kondisi pekerja, serikat pekerja, komunitas olahraga, pencegahan kriminalitas, asosiasi pemilik rumah, pendidikan pemilu, pengawasan pemilu, advokasi...",7,"Writing,Copywriter,Content Writer,Artificial Intelligence",20/05/2023 11:54:05 WIB,Penulisan Artikel Bahasa Indonesia 300-500 Kata Menggunakan Ai
10000000,"saya sedang mencari personal maupun kelompok yang bisa mengerjakan mobile web fullstack menggunakan react js dan node js untuk pengerjaan 2 aplikasi : 1) aplikasi qurban (2 minggu), 2) aplikasi fundraising ( 2 bulan ). design sudah ada, untuk projek sudah ada sebelumnya bisa cek linknya disini : 1) https://qurban.langkahnyata.com/category.php?category=qurban-ln , 2) https://langkahnyata.com/ cuma pingin di re-write ke reactjs dan nodejs. kami mencari kandidat yang domisili di bandung raya atau cimahi (mohon maaf untuk daerah lain tidak kami utamakan)",90,"NodeJS,ReactJS",20/05/2023 06:44:09 WIB,Membuat Mobile Web Untuk Fundraising
1000000,yang punya akun canva creator element tidak dipakai atau tidak terawat atau mau dijual biar saya beli buat saya rawat  bisa sertakan screenshot menu creator nya di chat ya kak,5,"Graphic Design,Canva",03/05/2023 16:08:19 WIB,Cari Canva Contributor / Creator Element
2500000,"saya memerlukan aplikasi monitoring rekap suara. aplikasi dapat di akses via mobile maupun web agar mudah juga di aplikasikan. aplikasi ini nantinya saya gunakan di lingkukan desa dan aplikasinya dapat terkoneksi dengan kpu, menggunakan api dan juga scraping data. jika worker menyanggupi, silahkan lampirkan portofolio dan juga contoh aplikasi yang menyerupai dengan yang saya inginkan sebagai bahan pertimbangan saya dan tim juga",35,"Web Programming,Web Scrapping,UX Design,VB.Net,API Gateway",06/05/2023 14:44:57 WIB,Rekapitulasi Data Suara
5000000,"saat ini kami sedang membutuhkan developer atau tim developer untuk membuat booking venue atau lapangan secara garis besar sistem ini akan digunakan oleh management lapangan untuk mengatur lapangan mereka fitur  - lapangan : untuk mengatur detail lapangan - booking : untuk melihat jadwal lapangan yang sudah dibooking (dalam bentuk calendar mingguan atau bulanan) - web front : web untuk pelanggan melakukan booking - pelanggan : berisi informasi pelanggan yang pernah booking sebelumnya - dan fitur pendukung lainnya - mobile app (web app) persyaratan - bertanggung jawab dalam pekerjaan - memiliki komunikasi yang baik - memiliki pengalaman membuat sistem erp akan menjadi nilai lebih - dapat membuat system dengan ui yang rapih  untuk teknologi, kami sangat terbuka dengan rekomendasi dari tim anda",7,"PHP,NodeJS,ReactJS",15/05/2023 09:52:40 WIB,Dibutuhkan Tim Developer Untuk Membuat Sistem Booking Venue Atau Lapangan
1000000,dibutuhkan ui/ux designer untuk membuat design tampilan erp output design adalah web dashboard dan juga mobile app persyaratan - bertanggung jawab dalam pekerjaan - memiliki komunikasi yang baik - memiliki pengalaman membuat sistem erp akan menjadi nilai lebih - memiliki pemikiran yang kritis untuk membuat flow yang efficient - mahir dalam menggunakan figma - mampu membuat design ui/ux yang clean dan terstruktur tolong lampirkan portfolio pada tawaran anda,7,"Graphic Design,UI Design,UX Design",15/05/2023 09:52:08 WIB,Dibutuhkan Ui/Ux Designer Untuk Membuat Sistem Erp
1500000,"mencari freelancer yang bisa membuat website, dengan gambaran sbb : 1. webiste bisa disetting dihalaman administrator (informasi selengkapnya menyusul), 2. website bisa memberitahukan agenda kegiatan, tampilannya harus menarik 3.  website ada melakukan transaksi database [crud] 4. website memiliki minimal 10 tema yang berbeda dan bisa di ganti ganti, jadi tampilannya tidak monoton tiap bulannya.  5. menu pada website  akan didiskusikan lebih lanjut diperlukan update progress pengerjaan minimal setiap 3 hari sekali, boleh melakukan zoom meeting untuk diskusi...",30,"MySQL,ASP.NET,PHP,Wordpress",08/05/2023 14:45:40 WIB,Membuat Website
250000,"kami saat ini mencari editor e-book yang akan bertanggung jawab untuk memastikan bahwa konten digital kami bersih, ditulis dengan baik, dan bebas dari kesalahan. anda akan bekerja sama dengan tim penulis kami untuk menghasilkan e-book berkualitas tinggi yang memberikan nilai bagi pembaca kami. kami punya 4 mini e-book sekitar 10-15 halamn yang perlu di redesign. mohon apply jika kamu punya halaman serupa dan lampirkan portfolio ebook yang sudah pernah anda design.",7,"Graphic Design,Microsoft PowerPoint,Microsoft Word",13/05/2023 13:46:30 WIB,Merapihkan Short E-Book(S) Yang Sudah Di Buat
500000,tugasnya hanya ambil foto 360 derajat di 15 lantai di perpusnas siapa tahu ada yang pernah dan bisa ngambil foto 360 silahkan tanya tanya dulu,2,"3D Modelling,Photography",13/05/2023 10:54:22 WIB,Pengambilan Foto 15 Lantai Di Perpusnas Jakpus
500000,dicari programmer yang bisa melakukan refactore php 5.4 ke php 7.4,3,"PHP,CodeIgniter",16/05/2023 18:24:32 WIB,Revamp Php 5.4 Ke Php 7.4
3000000,terdiri dari fitur : pemesanan jadwal booking pendaftaran dan rekam medis pasien jadwal & profil dokter (multi branch) freelancer harus menunjukan portofolio sejenis yang mendekati platform ios dan android (kalau cuma bisa deploy android dimaklumi) backend dengan laravel & mysql,25,"Database Programming,MySQL,Mobile Programming,Android,iPhone/iOS,Web Programming,Laravel Framework,Android studio,Flutter",16/05/2023 18:22:27 WIB,Pembuatan Aplikasi Flutter Klinik Gigi
200000,saya ingin bisa mengirim  data dari file excel yang diberi barcode dan bisa discan dari hp dan bisa menginputkan hasil scan ke file excel yg lain,5,Microsoft Excel,10/05/2023 19:48:54 WIB,Mengirim Data Dari Excel Dengan Barcode
100000,"tulisan pendek, memenuhi niche musik luar dan hal yang terkait. 10 jenis tulisan tentang musik luar atau grup band luar.",3,"Writing,Content Writer",18/05/2023 07:02:05 WIB,Dibutuhkan Konten Tulisan
1000000,saya butuh orang yang bisa integrasi nya arcore atau semacam nya untuk kebutuhan augmented reality indoor navigation menggunakan bahasa pemrograman kotlin,7,"Android studio,Kotlin",17/05/2023 23:12:38 WIB,Augmented Reality Indoor Navigation Pakai Kotlin
450000,"hi, kami sedang mencari freelance writer yang siap membantudalam membuat profil organisasi, adapun kedepannya jika hasil pekerjaanbagus bisa membuka kemungkinan untuk project-project lain. berikut detail untuk project ini: 35 profil organisasi dengan 400-500 kata per organisasi instruksi jelas agar diharapkan revisi minimal profil organisasi buatan sendiri (original) tidak perlu seo atau keyword stuffing selebihnyabisa dicek lampiran project ini, untuk detail organisasi yang digunakanbisa random saja, nanti detail organisasi bisa disesuaikan sendirisesuai keperluan penggunaan profil...",7,"Writing,Copywriter,Content Writer",20/05/2023 11:52:56 WIB,Penulisan Profil Organisasi Dalam Bahasa Inggris
450000,"hi, kami sedang mencari freelance writer yang siap membantu dalam membuat profil organisasi, adapun kedepannya jika hasil pekerjaan bagus bisa membuka kemungkinan untuk project-project lain. berikut detail untuk project ini: 35 profil organisasi dengan 400-500 kata per organisasi instruksi jelas agar diharapkan revisi minimal profil organisasi buatan sendiri (original) tidak perlu seo atau keyword stuffing selebihnya bisa dicek lampiran project ini, untuk detail organisasi yang digunakan bisa random saja, nanti detail organisasi bisa disesuaikan sendiri sesuai keperluan penggunaan profil...",7,"Writing,Copywriter,Content Writer",20/05/2023 11:52:47 WIB,Penulisan Profil Organisasi Dalam Bahasa Indonesia
1000000,"dicari untuk dibeli, akun google adsense untuk website, sudah pin, pin + po, atau fresh tulis spek: ✅ adsense untuk blog/website ✅ email utama ✅ iklan tayang 100% ✅ infokan sudah po/pin atau fresh ✅ apakah ada domain yg terhubung mohon kirimkan screenshot adsense yg berhubungan dengan spek di atas. terimakasih",30,"Blog,Blogspot,Wordpress,Wordpress Templates,Google Adsense,Google Adwords,Google Admob",06/05/2023 12:00:01 WIB,Dibeli Akun Google Adsense Untuk Website
1000000,dicari akun google adsense indonesia non hosted lama kalo bisa dashboard dollar (2015 awal ke bawah) atau yang baru tidak apa2. untuk yg baru diusahakan ada domain yg terhubung. tulis spek: ✅ adsense untuk blog/website ✅ email utama ✅ iklan tayang 100% ✅ infokan sudah po/pin atau fresh ✅ apakah ada domain yg terhubung mohon kirimkan screenshot adsense yg berhubungan dengan spek di atas.,66,"Internet Marketing,Blog,Blogspot,Wordpress,Google Adsense,Google Adwords,Google Admob",29/04/2023 18:53:48 WIB,Dicari Akun Google Adsense Indonesia Non Hosted Untuk Web
1000000,"pembuatan website organisasi dengan php, bootsrap framework, javascript. standar web organisasi :  tema hijau islamic.  halaman utama (index):  navigasi, banner, berita, pengumuman, link, footer. navigasi :  profil (dropdown menu bisa di edit oleh admin, struktur organisasi, personil, dll)  gallery (drodown menu : foto dan video)  link (dinamis, ada gambar dan link),  download (dropdown menu untuk dokumen apa yang mau di download, download file pdf, ppt, doc, jpg, zip | untuk download cukup nama file kemudian icon download),  wa service (ada icon wa pada halaman utama, kemudian saat di klik, diarahkan ke wa web ke nomor kontak wa organisasi)...",7,"JavaScript,PHP,CSS",06/05/2023 07:24:01 WIB,Pembuatan Website Organisasi
6000000,"saya membutuhkan freelancer yang terbiasa mengajar ms excel mengajar 5 hari dalam seminggu (senin - jumat) 1 hari 3 sesi mengajar, sbb : 09.00 - 12.00 13.00 - 15.00 17.00 - 20.30 rutin setiap hari hanya untuk yang bisa fulltime kontrak selama project berlangsung. syarat : pengalaman di bidang mengajar pengalaman ms excel punya akun linkedin dan mau di update",30,"Microsoft Excel,Consultancy",06/05/2023 06:19:23 WIB,Pengajar Ms Excel (Full Time Remote)
200000,"dear teman2 project, saya membutuhkan program excel, untuk perhitungan transfer panas, dari pompa hingga ke media yang ingin dipanaskan, disini media yang ingin dipanaskan itu berputar, dan transfer oli panas menggunakan pipa, bisakah teman2 project membantu saya?? jika ada yang bisa, berikan penawaran harga terbaiknya, terima kasih",14,"Microsoft Excel,Analysis",15/05/2023 09:50:48 WIB,Program Excel Perhitungan Transfer Panas
4000000,"saat ini kami sedang membutuhkan developer atau tim developer untuk membuat sistem accounting sistem ini akan mengikuti flow https://akaunting.com/ secara functional, namun harus memiliki fitur double entry dan juga inventaris. persyaratan - bertanggung jawab dalam pekerjaan - memiliki komunikasi yang baik - memiliki pengalaman membuat sistem erp akan menjadi nilai lebih - dapat membuat system dengan ui yang rapih  untuk teknologi saat ini kami lebih cenderung menggunakan php, tapi terbuka untuk masukan dari dev...",40,PHP,15/05/2023 09:20:53 WIB,Membuat Sistem Accounting
1000000,kami sedang membutuhkan freelance content writer yang sudah berpengalaman untuk skala nasional ya. membuat konten 3 - 4 perharinya,30,Content Writer,08/05/2023 13:58:20 WIB,Freelance Content Writer
100000,"saya membutuhkan jasa survey untuk menyebarkan kuesioner penelitian tentang perilaku kerja inovatif. adapun kriteria responden yang dibutuhkan adalah sebagai berikut : jumlah responden 30 orang karyawan divisi marketing perusahaan transportasi online (10 orang dari gojek, 10 orang dari grab, 10 orang dari maxim) karyawan tetap dengan masa kerja minimum 2 tahun.",7,"Data Entry,Statistical Analysis,Affiliate Marketing,Social Media Marketing (SMM),Responden,Social Media",08/05/2023 13:56:43 WIB,Pra Survey Penelitian
350000,"saya punya desain rumah tinggal, sedang mencari engineer sipil untuk konsultasi agar desain saya aman secara struktur.",30,"Architecture,Civil and Structure Analysis,Civil and Structure Design",05/05/2023 19:58:57 WIB,Konsultasi Desain Struktur Rumah Tinggal
