budget,description,finishDays,project_tags,publishedDate,title
200000,membuat 20 artikel untuk menaikkan seo  dengan syarat sebagai berikut artikel = 500 kata dengan 4 gambar. upload ke wordpress cari gambar minimal 4 gambar per artikel edit background gambar dahulu sebelum post tapi ukuran harus dibawah 100kb seo harus hijau semua (yoast seo) save di draft nanti akan saya periksa search kata kunci nya di whatsmyserp minimal kata kuncinya 4 kata judul di ajukan oleh content writer,7,"Search Engine Optimization (SEO),Wordpress,Copywriter,Content Writer",03/05/2023 12:22:24 WIB,Buat Artikel Untuk Menaikkan Seo
500000,saya perlu asisten konsultan... yang berdomisili di tangerang mengerjakan 10 laporan setiap minggunya,7,"Business Analysis,CorelDRAW,Corel PhotoPaint,Analysis",03/05/2023 12:20:45 WIB,Asisten Konsultan
500000,"i am looking for php developer to develop landing page using a custom framework. you are required to convert an existing landing page (built using older version of the custom framework) to a new landing page (with the same contents) using newer version of the custom framework. the current landing page consists of the following sections: - header menu (logo and call link) - hero, cover image with a lead form - service benefits, 4 bullet points with description - side bar images (4 photos) - service list, 5-10 items of bullet points - about, 2 paragraph of text with a google maps embed - photo gallery with slider - testimonials, with list of logo thumbnails and 1 testimonial text paragraph you are not required to create the above from scratch, but rather migrate the above contents which already exists to a new template design...",14,"PHP,Bootstrap,Git",03/05/2023 12:20:29 WIB,Php Landing Page Development Using Custom Framework
75000,"halo freelancer, saya membutuhkan writer, dengan ketentuan sebagai berikut tema : laptop atau trouble shooting / perbaikan laptop jumlah artikel : 10 jumlah kata per artikel : 300 kata artikel disertai gambar (gambar tidak memiliki hak cipta, boleh diambil dari pixabay). bahasa penulisan santai, tidak kaku. writer langsung menulis di blog. artikel tidak copy paste (akan dicek dan minta perbaikan jika terdapat artikel hasil copy paste). project selesai jika telah selesai menulis 10 artikel dan semua artikel disetujui...",7,"Writing,Blog,Blogspot,Content Writer",13/05/2023 20:36:52 WIB,Butuh Writer
150000,"selamat siang, saya butuh 1 orang frelancer untuk mengisi artikel di website kami secara reguler. dibutuhkan 15 fresh artikel setiap bulannya untuk website karunggoni.id, rutin selama 6-12 ke depan (tergantung kualitas artikel). budget 150.000 - 250.000 tergantung kualitas artikel. persyaratannya: sudah berpengelaman bikin artikel orisinil (bukan copas edit) artikel minimal 500 kata paham betul tentang seo dan turunannya bersedia untuk memahami product knowledge perusahaan sebelum bikin artikel, agar artikel yang dibuat nanti isinya tidak melebar dan tetap membawa nilai perusahaan di dalamnya...",7,"Writing,Blog,Blogspot,Wordpress,Copywriter",13/05/2023 20:08:38 WIB,Dicari Freelancer Artikel (Jago Seo) Untuk Perusahaan Manufaktur
350000,mengubah codingan dari php native menjadi ci 3 dan menggunakan adminlte,7,CodeIgniter,13/05/2023 19:41:19 WIB,Programmer Ci 3
150000,"mengembalikan satu akun google yang tidak bisa diverivikasi oleh goggle (lupa sandi) tidak ada nomor hp, tidak ada email pemulihan dan tidak ada verivikasi 2 langkah. mohon dibantu untuk pemulihannya sehingga nanti bisa login email dan gdrive lagi. "" akun tersebut adalah benar merupakan akun sah yang kami miliki, semua dampak hukum dari pemulihan akun tersebut adalah menjadi tanggungjawab kami sepenuhnya""",2,"Administrative Support,Google Workspace",30/04/2023 15:06:00 WIB,Mengembalikan Akun Google Yang Tidak Bisa Di Verivikasi
1000000,"fast growing digital agency, need's creative team to support our clients in jatinangor bandung. we hope it's you.   - responsible for creating & managing social media campaign   - create creative content : video & photo    - gooo analytic & communication skill   location : jatinangor bandung",30,"Video Production,Analysis,Social Media",30/04/2023 10:04:40 WIB,Freelance Socmed Specialist
2500000,"info website: dibuild menggunakan wp www.fighterlighter.id rule: gunakan cara white hat seo no black hat seo (full abritrase 100% owner) page 1 google keyword ""korek api gas"" tidak page 1 google (tidak harus diatas sendiri, yang penting page 1) ingat ya, seo bukan sem mohon sertakan portofolio projek yang pernah dikerjakan, no wa/email **harga bidding boleh diatas budget range happy bidding",90,Search Engine Optimization (SEO),30/04/2023 06:11:38 WIB,Seo Page 1 Google Bergaransi
150000,cari yg bisa bantu upload apk ke akun saya. pengerjaan via remote anydesk. file aab dan akun playstore sudah ready.,7,"Android,Android studio",28/04/2023 09:41:28 WIB,Upload Apk Ke Playstore
1000000,"dicari yang bisa buat web registrasi anggota organisasi , dimana nanti anggota menginput datanya sendiri, lalu setelah itu di otorisasi oleh admin.  nanti anggota yang mendaftar akan mendapat e-kta sebagai contoh https://digital.nasdem.id/ bisa wa ke saya: 08xxxxxxxxxx9  admin note: dilarang mencantumkan ataupun meminta kontak pribadi pada deskripsi project ataupun pada link yang anda cantumkan. semua komunikasi harus dilakukan melalui fasilitas yang sudah disediakan projects.co.id...",14,"Web Programming,Web Design,Website Building",27/04/2023 22:32:25 WIB,Buat Web Registrasi Anggota
1000000,"halo, saya butuh worker yang bisa membuat aplikasi android untuk organisasi, tujuan aplikasinya adalah utk mencetak kartu anggota secara digital. alurnya : anggota mengisi data diri melalui aplikasi -> admin approvement melalui admin panel -> kartu terbit dan bisa didwonload melalui aplikasi mockup sudah tersedia di figma silahkan share portfolio anda saat bid",7,"Mobile Programming,Android,React Native,Kotlin",27/04/2023 22:10:07 WIB,Membuat Aplikasi Android Untuk Kartu Anggota
500000,"terbuka jasa untuk melakukan scripting atas hasil rekaman audio dan/video dari durasi 30 - 60 menit ke bentuk word dan dilakukan translate ke bahasa inggris setelahnya. ketentuan: tidak boleh menggunakan ai, tools generator atau converter karena hasil nya akan ngaco, mesti manual. jika ada yang tidak jelas tolong di highlight kuning pada draft hasil pekerjaan baik bahasa indonesia atau bahasa inggrisnya.  hasil transkrip lengkap, 1 file audio/video ke 1 file word (scipt bahasa indo + translate inggris)...",1,"Transcription,Business Document Translation,Translation",26/04/2023 12:27:01 WIB,Jasascripting Dari Recording Dan Terjemahkan Ke Bahasa Inggris
150000,"dibutuhkan pembuat soal untuk latihan soal masuk sma favorit: 1. sma taruna nusantara magelang 2. sma pradita dirgantara 3. sma taruna nala malang 4. sman 5 taruna brawijaya kediri 5. sma taruna angkasa madiun, dll. - soal yang dibuat antara lain: b. indonesia, b. inggris, matematika, ipa terpadu, ips terpadu, soal psikotest - boleh pilih salah satu mapel yang dikuasai - 1 paket soal terdiri dari 50 soal/mapel beserta pembahasan. - dibutuhkan 1 paket per masing-masing mapel. silahkan bisa bid dan lampirkan portofolio yang mendukung...",7,Microsoft Word,26/04/2023 11:41:13 WIB,"Pembuatan Latihan Soal Ujian Masuk Sma Taruna (Taruna Nusantara, Taruna Nala, Taruna Angkasa Dll)"
2500000,"kami membutuhkan seorang ahli pembuat resep untuk pabrikan ekstrudat. dalam hal ini ekstrudat coating kacang, kami perlu cara coating yang benar seperti apa dan bagaimana resepnya  bagi anda yang sudah mengerti susunan komposisi produk dan % nya, bagi anda yang mengerti alur produksi khususnya ekstrudat mari silahkan mencoba",7,"Business Consultation,Analysis",26/04/2023 11:35:04 WIB,Butuh Resep Detail Ekstrudat Costing Kacang
500000,"dibutuhkan cepatttt!!!! freelancer handal dan terpercaya dalam melakukan editing video offline. adapun lingkup pekerjaan: 1. melakukan editing offline raw material video hasil shooting dan sub tittle dalam b indonesia 2. durasi video : 3 - 5 menit 4. waktu pengerjaan offline editing : 10 video per hari jika anda memenuhi kualifikasi tersebut di atas, silakan ajukan penawaran terbaik anda!",1,Video Editing,07/05/2023 08:58:22 WIB,Editing Offline Video Edukasi
3000000,"hai .... saya mencari programer untuk website rental mobil multy vendor berbasis toko online dengan schema sebagai beikut : front end : pilih lokasi (google api )--> pilih jam penjemputan-->pilih kendaraan--> pilih durasi sewa--> pilih pemberhentian terakhir (optional ) --> check out ( rest api ke payment gateway )  ada dua kalau usd pakai paypal kalo idr pakai xendit . jenis user : client (penyewa ) member ( pemilik mobil) super admin  admin finance backend : booking schedule, pembayaran, membership,, komisi, data mobil ,data asuransi kendaraan, data pengemudi pemiliki mobil (optional) -->  localization untuk cabang pemesanan kendaraan multi item dan multi merk juga multi jenis sewa jenis sewa  : transfer 3 jam chartered 10 jam   jam jam an minimal 3 jam bulanan lepas kunci dan dengan pengemudi  website dinamis dan hybrid",7,"MySQL,Web Programming,JavaScript,PHP,Website,Web Design,Website Building,Java Native",07/05/2023 06:40:34 WIB,Buat Website Rental Mobil Multi Vendor
3000000,membuat website menggunakan wordpress : termasuk cta registrasi payment gateway dapat terintegrasi dengan version control,30,"PHP,Wordpress,Wordpress Templates,Laravel Framework,Github",07/05/2023 06:35:18 WIB,Website Menggunakan Wordpress
5000000,saya ingin membuat sistem membership dengan produk cloaker. sekilas cloaker bermanfaat untuk membypass moderasi iklan overclaim/gray di platform medsos dan saya juga akan mengenakan biaya kepada pengguna layanan saya dengan biaya perbulan dengan pembayaran tripay dan crypto payment gateway nowpayment. berikut fitur ringkasan fitur yang saya inginkan: membership input white page dan landing page proteksi dari vpn/proxy proteksi dari isp (yang sudah diblacklist dari database admin) blokir negara tertentu whitelist negara tertentu dan beberapa fitur lainnya akan saya berikan web contoh sebagai referensi pengerjaan bagi yang sanggup silahkan melakukan bid...,7,"Database Programming,Web Programming,JavaScript,PHP,Website,Web Design",01/05/2023 06:10:38 WIB,Pembuatan Situs Cloaker
150000,"mencari penulis yang paham seo untuk membantu saya dalam membuat artikel seputar ilmu teknik sipil, mesin, dan listrik. artikel yang ditulis tidak harus menjurus namun bisa bersifat lebih general agar mudah dibaca masyarakat awam. jumlah minimal dalam satu artikel yaitu 600 kata. silakan bid sesuai kemampuanmu, nantinya akan saya berikan next step nya untuk kamu bisa masuk seleksi.",7,"Search Engine Optimization (SEO),Architecture,Writing,Copywriter,Content Writer,Electronic",11/05/2023 20:24:47 WIB,"Penulis 5 Artikel Seputar Teknik Sipil, Teknik Mesin, Dan Teknik Listrik"
250000,"saya mencari satu orang freelancer basis di surabaya kota yang dapat membantu saya untuk survei lokasi tanah / rumah yang saya ingin survei (untuk dibeli & dihuni sendiri), mencari informasi owner, dan mengerti tentang konstruksi bangunan.  pembayaran per properti yang diobservasi, silahkan offer angka per properti informasikan nama, usia, kendaraan, lokasi tinggal di surabaya terima kasih",1,Personal Assistant,15/05/2023 20:35:08 WIB,Properti Surveyor Surabaya
750000,"halo, saya mencari freelancer berpengalaman untuk desain buku tentang menurunkan berat badan dengan cara diet dan olahraga (menggunakan desain dan illustrasi modern). total ada 70 halaman (dengan gambar), jika tanpa gambar jauh lebih sedikit jumlah halamannya. gambar dan ilustrasi bisa menggunakan stock photo (nanti saya bantu dapatkan) atau menggunakan midjourney. freelancer harus melampirkan contoh halaman buku yang pernah dibuat sebelumnya. terima kasih.",5,"Graphic Design,Logo Design,Web Design,Adobe Indesign,UI Design,UX Design",15/05/2023 19:23:42 WIB,Desain Ebook
500000,saya ingin membuat perhitungan lebih dari 1 tarif dalam 1 pemakian dengan syarat ketika aplikasi diclose lagi billing tetap sesuai perhitungan dan melanjutkann perhitungan. saya basic menggunakan java untuk pembuatan,3,"Java,Java Swing,Java Native",09/05/2023 22:13:36 WIB,Perhitungan Multi Tarif Pada Billing Futsal Menggunakan Java
750000,disistem kami ingin menambahkan fitur wallet dimana tablenya sudah ada untuk detilnya silahkan cek url ini https://www.evernote.com/shard/s720/sh/df74f675-7d85-0c91-8fee-2b71abeaa725/,7,CodeIgniter,17/05/2023 07:06:19 WIB,Menambahkan Fitur Wallet
750000,"dear worker.... saya sedang mencari freelancer untuk bagian admin website untuk melakukan kegiatan publish artikel. adapun kriteria yang saya cari yaitu : memahami dasar photoshop sudah terbiasa melakukan upload artikel menggunakan platform wordpress baik versi lama dan juga versi baru memahami minimal konsep dasar seo onpage atau memasang internal backlink di artikel adapun untuk job description dan juga alur kerja adalah sebagai berikut (mohon di perhatikan) anda akan kami kirimkan artikel yang nantinya akan diupload di website kami, kami memiliki beberapa website yang nantinya akan diinfokan lebih detail...",30,"Data Entry,Website,Blog,Wordpress",17/05/2023 07:06:00 WIB,Admin Website Untuk Publish Artikel Di Website
1000000,"yang punya akun canva contributor grafik elemen yang tidak terawat atau mau dijual, saya siap nampung",20,"Graphic Design,Canva,Grafis Vektor",16/05/2023 21:16:00 WIB,Dicari Akun Canva Contributor Elemen
750000,"membuat website company profile seperti  website ini https://www.wika-beton.co.id/ boleh dengan wordpress ataupun reactjs tapi untuk cms tetap pakai wordpress agar lebih mudah maintanance, juga beserta dengan hostingan dan maintanance kedepannya seperti biaya hosting per tahun dan lain"", tolong kalkulasi harga dilakukan dengan jelas dari awal, kalau bisa dibuatkan dengan jelas biayanya di excel dari awal",7,"Wordpress,Wordpress Templates,ReactJS",18/05/2023 14:28:01 WIB,Membuat Website Company Profile
1500000,"sesuai dengan judul, saya sedang mencari seorang content writer untuk tema khusus dalam bidang it. jumlah kata minimum di 500. saya mencari content writer  yang berpengalaman dan dapat menulis artikel yg berkualitas dan detail. juga tolong lampirkan contoh artikel anda (jika ada artikel yg berbahasa inggris akan sangat baik). terima kasih harga yg tercantum adalah utk kisaran 8 artikel/bulan (2 artikel/minggu)",30,"Copywriter,Content Writer",18/05/2023 13:51:38 WIB,Dicari Content Writer Untuk Artikel It
500000,"dibutuhkan jasa pelaporan spt dan pendapat finalisasi laporan keuangan. laporan keuangan terlah jadi, dibutuhkan jasa pendapat untuk finalisasi laporan keuangan dan melakukan laporan spt",7,"Tax Consultation,Accounting,Financial Planning",04/05/2023 14:36:30 WIB,Lapor Spt Indonesia
2000000,"butuh segera 1 orang admin online shop kriteria admin online: wanita umur 19-30 tahun bisa edit foto produk lebih bagus kalo bisa edit video bisa upload ke market place bisa handle market place bisa print resi market place biasa packing barang dengan rapih dan cepat minimal sma, ada ijazah domisili deket glodok diutamakan pengalaman pernah jadi admin online dibidang perkakas seperti tang, obeng, solder, tester job desk admin online: foto produk upload produk terima pesanan  siapin barang print resi packing barang beresin barang  ambil barang bebersih toko dst dst jam kerja: senin-sabtu jam 8 - selesai jangan chat disini langsung aja wa  nama: umur: alamat: pengalaman: pendidikan terakhir: contoh foto produk yang pernah dibuat: bisa langsung interview, test edit foto",7,"Graphic Design,Illustration,Adobe PhotoShop,Corel PhotoPaint,Vector Graphics,Adobe Illustrator,Photography,Video Editing,Adobe Premiere,Video Animation",03/05/2023 11:18:58 WIB,Editor Foto Onlineshop
3500000,"saya ingin mengajukan project pembuatan mobile application berdasarkan moneysite kami yang sudah berjalan. requirement : fungsi dari aplikasi ini nanti ialah di sisi client kami, sebagai user bisa menikmati permainan selayaknya di moneysite kami, bisa melakukan topup dengan lancar, akses ke promosi page dengan lancar, akses ke layanan cs live chat kami tanpa kendala harus berpindah ke new page atau layar berbeda. seamless experience. - aplikasi bisa di gunakan di android 9 ke atas dan ios 10 ke atas - pada backend side terdapat pilihan add/remove link website address, di tujukan agar bisa mengganti link tujuan moneysite  - sudah responsive bisa bekerja di semua jenis smartphone & tablet...",5,"Java,JavaScript,C/C++,ReactJS,Flutter,Kotlin",03/05/2023 11:18:26 WIB,Aplikasi Mobile Untuk Moneysite
1500000,"hallo  saya pengen tools bentuknya add on atau ekstensi chrome, yang mempunyai fitur sebagai berikut : mencari grup yang diingikan bisa mencari berdasarkan tipe grup misalkan closed grup atau publik grup. bisa mencari berdasarkan minimal jumlah anggota grup bisa mencari grup yang terbuka postingnya, karena ada grup yang hanya admin yang boleh post bisa auto post ke grup secara massal, dan ada settingan jedanya sekian detik per grup bisa mencari grup yang aktif usahakan hasil post dibuat seakan akan manusia yang posting bukan robot bisa auto join grup yang ditemukan  saat auto post maka dibikin mengetik tulisan , atau seperti copy paste bisa postingan secara spintax bisa auto post berdasarkan teks dan gambar dan video bisa spin gambar agar tiap group berbeda beda agar terkesan natural toolsnya bisa diprotect agar tidak bisa dipakai semua orang alias dibikinkan licensenya silahkan bagi yang berminat,' ajukan bid nya segera disertai dengan portofolis nya...",7,"Programming,Firmware Programming,Linux Programming,.NET Compact Framework,Web Programming,JavaScript,Windows Programming,.NET Framework,C/C++,Desktop Programming",13/05/2023 19:31:44 WIB,Membuat Ekstensi Atau Add On Chrome Untuk Fiur Auto Post Ke Grup Fb
200000,"saya membutuhkan seseorang yang dapat membantu saya migrasi dari blogger ke wordpress tanpa kehilangan traffik, saya butuh orang yang benar-benar paham atau pernah melakukannya, bukan coba-coba, maaf karena saya tidak ingin kehilangan traffik, terima kasih",7,"Blogspot,Wordpress",30/04/2023 06:10:58 WIB,Bantu Migrasi Dari Blogger Ke Wordpress
5000000,pembuatan billing game virtual reality yang mirip dengan billing warnet pada umumnya server : windows ws : virtual reality headset merek pico 4 (os : android) menu: billing lama pemakaian (bisa paket permenit/perjam) remote desktop lock screen app launcher update app beda harga member dan non member data member laporan pembatasan hak akses operator dan admin makanan dan minuman seperti billing warnet pada umumnya,30,"Android,Netop Remote Control",29/04/2023 22:05:24 WIB,Software Billing Game
3000000,"aplikasi ini di tuju untuk menghitung pemungutan data suara perwilayah, rt,rw, kelurahan, kecamatan database dan data lainnya harus sinkron dengan data yang ada di kpu.  jenis aplikasi bebas.  contoh aplikasi (sirekap 2023/2024) atau aplikasi kotak suara kpu.  di sediakan juga tools untuk broadcast sms point point atau tambahan lainnya akan di bicarakan lagi.  silahkan di lapirkan profil dan tambahan ide agar saya bisa pertimbangkan",30,"Email Support,PostgreSQL,jQuery,Ember.js,SQL Server,Github,Microsoft Visual Basic NET",29/04/2023 18:56:18 WIB,Aplikasi Penghitung Basis Data Suara
1500000,"di butuhkan freelance untuk pembuatan gsm (grafik standar manual) untuk project esports antar sekolah. list kv yang di butuhkan: - logo ""student championship"" - konsep template social media (feeds, story & reels) - design piala & medali (preferably 3d) - design merchandise (jersey, lanyard, notebook) - kv live streaming & transisi mohon lampirkan portfolio dan cv/resume. terima kasih!",7,"CorelDRAW,Graphic Design,Illustration,Logo Design,Adobe PhotoShop,Vector Graphics,Adobe Illustrator,AutoCAD,3ds Max",27/04/2023 17:19:35 WIB,Dibutuhkan Freelance Graphic Design Pembuatan Gsm Project Esports
1000000,"hello! saya mencari pemateri webinar menghadapi dunia kerja untuk lulusan baru / fresh graduate, dengan ketentuan sebagai berikut: memahami materi dan mampu menyampaikan materi dengan sangat baik (intermediate to expert). bisa bekerjasama dengan tim dan mampu berkomunikasi dengan baik. diutamakan yang berpengalaman di dunia hrd. topiknya seputar tips-trik melamar pekerjaan, cv, rekrutmen, tes seleksi, interview, dsb. ada beberapa sesi dengan total durasi 3 jam dengan fee 1-2 juta. jika anda punya tawaran di atas/di bawah itu, silakan...",7,"Business Analysis,Business Consultation,Business Proposals,Business Service,Business Plans,Microsoft PowerPoint,Administration,Microsoft Office,Microsoft Excel,Consultancy",27/04/2023 14:12:10 WIB,Pemateri Webinar Menghadapi Dunia Kerja Untuk Lulusan Baru / Fresh Graduate
1000000,"halo, saya butuh worker yang bisa membuat smm panel. smm panel merupakan penyedia layanan jasa social media, seperti jasa like, comment, dll mockup & ui ux sudah disediakan. skill yang diperlukan : jago integrasi api  bisa integrasi payment gateway jago php framework & db management kurang lebih fitur-fitur yang diperlukan : registrasi & login fitur deposit + integrasi pg fitur pemesanan fitur report fitur daftar layanan fitur referal fitur markup harga (admin) fitur integrasi layanan dgn api provider lain (admin) silahkan bid dan sertakan portfolio",14,"MySQL,JavaScript,PHP,CodeIgniter,Laravel Framework,ReactJS",26/04/2023 11:10:02 WIB,Pembuatan Sistem Social Media Panel (Smm Panel)
500000,"sya ada alat usb encoder, mau buat read/ write ke rfid card untuk buka kunci seperti kamar hotel, menggunakan php atau ad alat tambahan lainnya, klo ad demo yg sudah jadi.",30,PHP,26/04/2023 10:34:58 WIB,Read Write Usb Encoder Menggunakan Php/Codeigniter
500000,"mebutuhkan surveyor berpengalaman yang berdomisili di semarang untuk melalukan survey ke beberapa toko di 2 kecamatan di semarang per kecamatan 2 toko  data yang diperlukan : foto toko, jumlah barang yang dijual dan video sekitar toko membutuhkan waktu 1 hari, pekerja. hanya mewawancara pemilik toko",1,"Business Analysis,Business Consultation,Analysis,Data Analysis,Consultancy",26/04/2023 10:28:18 WIB,Mencari Surveyor Berdomisili Di Semarang
2500000,saya ingin membuat aplikasi chat untuk kantor saya yg bisa digunakan di android dan ios kurang lebih seperti wa atau telegram,14,"iPhone/iOS,Android studio",06/05/2023 15:42:31 WIB,Pembuatan Aplikasi Chat Utk Andoid Ios
140000,"membutuhkan penulis tentang  autocad. wajib sudah pernah menggunakan serta mengerti autocad. selain itu tidak akan diterima. spesifikasi: menulis artikel tentang autocad. tulisan santai tapi tidak selengean, artikel dapat dibaca dengan mudah, bukan artikel copas dan spin, disertai gambar tiap artikel. tulis langsung di wordpress. budget untuk artikel adalah  rp 35 per kata. jadi artikel dengan panjang 1.000 kata x rp 35 = 35b per artikelnya. waktu pengerjaan projects 10-20 hari. saya membutuhkan 4 artikel dulu, kalo oke lanjut lagi...",5,"AutoCAD,Content Writer",11/05/2023 17:20:43 WIB,Membutuhkan Penulis Tentang Autocad
500000,saat ini kami membutuhkan jasa seo website kami untuk masuk ke halaman pertama google terutama menjadi top 3 website kami adalah landing page untuk sebuah software tolong lampirkan portfolio anda terimakasih,7,"Search Engine Optimization (SEO),Google Adsense,Google Adwords",11/05/2023 13:37:13 WIB,Dibutuhkan Jasa Seo Untuk Masuk Page One
2000000,"buat aplikasi taking order yang memunculkan stock gudang, harga barang, multi satuan, diskon item, diskon faktur.",7,"MySQL,Android",15/05/2023 17:16:49 WIB,Pembuatan Aplikasi Taking Order Dari Aplikasi Isx Untuk Distributor
1000000,"yang punya akun canva creator template yg ngangur/tidak terpakai boleh tawarkan, harga bisa dibicarakan. akun yg ada tulisan seperti ini.",5,Canva,09/05/2023 09:56:45 WIB,Cari Akun Canva Creator Template
9000000,"dengan hormat     saat ini kami membutuhkan worker expert dengan kriteria     memahami seo     bisa menterjemahkan tool audit neil patel,sem rush, kwfinder, dll     memahami search console dan page speed google serta google index     memahami copy writer        untuk dapat melakukan seo 3 keyword di 1 website dengan target seo score 90",30,Search Engine Optimization (SEO),15/05/2023 15:59:02 WIB,Seo Writer Content Penulis
15000000,"kami membutuhkan freelancer sebagai tenaga pelatih untuk mengajar digital marketig  ketentuan  mengajar 5 hari dalam seminggu (senin - jumat) 1 hari 3 sesi mengajar, sbb : -  sesi pagi 09.00 - 12.00 -  sesi siang 13.00 - 15.00 -  sesi sore 17.00 - 20.30 rutin setiap hari hanya untuk yang bisa fulltime kontrak 3 bulan selama project berlangsung. syarat : pengalaman di bidang kerja atau pengalaman mengajar  memiliki kualifikasi kompetensi yang relevan, yang dibuktikan dengan riwayat pengalaman di bidang yang relevan dengan bidang digital marketing punya akun linkedin dan mau di update untuk disesuaikan dengan profile tenaga pelatih",90,Internet Marketing,09/05/2023 18:32:07 WIB,Freelancer Pengajar
