budget,description,finishDays,project_tags,publishedDate,title
1500000,"halo, kami membutuhkan admin untuk support & maintain web wordpress portal berita, nilai bid yang kami tawarkan tersebut adalah bayaran per bulan, dan jika pekerjaan nya bagus maka pasti akan terus diperpanjang kerjasamanya. diutamakan yang berdomisili di jabodetabek karena walaupun pekerjaan nya lebih banyak remote tapi diwajibkan  onsite ke kantor di bekasi min 1 minggu sekali untuk report pekerjaan maupun diskusi pengembangan/kendala. apabila  memiliki skill mengenai vps atau cloud server akan menjadi nilai tambah...",30,"Search Engine Optimization (SEO),Linux,Website,Wordpress",19/05/2023 14:35:43 WIB,"Admin Support,Seo & Maintain Web Wordpress Portal Berita"
1200000,"halo, saya lagi butuh flutter dev untuk bantu develop mobile app untuk poin dan loyalty system. flownya sangat mudah tidak complex. design: https://www.figma.com/file/hmiagxljw5vvbrjmgieewd/goodsone-hifi-dev?t=wdjybcps4o1e3qc1-0 scope pekerjaan: 1. slicing design dari figma 2. integrasi backend api, koordinasi sma orng backend apa aja yg dibutuhkan 3. validasi, error state harus pake, shimmer loading juga 4. push notification menggunakan firebase 5. redux state management dan diutamakan clean code 6...",30,"Mobile Programming,Flutter,Kotlin",05/05/2023 14:18:10 WIB,Butuh Flutter Developer Untuk Develop Poin System
200000,tugas 1 menejemen strategi dan sumber daya manusia (7 soal) tugas 2 manajemen merek dan pemasaran digital (5 soal) tugas 3 perilaku konsumen dan komunikasi pemasaran (4 soal) tolong perhatikan file terlampir terima kasih,2,"Business Analysis,Accounting,Internet Marketing,Sales and Marketing,Business Plans,Market Research,Marketing Strategy,Administration,Analysis,Data Analysis",05/05/2023 12:54:26 WIB,Tugas Kuliah Menejemen Pemasaran
5000000,butuh buat program jualan untuk fnb serta include accounting.      yg bisa di pantau penjualan secara online.,7,"Accounting,Database Programming,Google Cloud Developer",04/05/2023 06:55:18 WIB,Membuat Program Jualan Fnb
1000000,"halo, saat ini saya sedang mencari freelance yang dapat mewujudkan project yang ingin saya miliki, pada kriteria web admin ini hanya untuk transaksi ppob dengan 1 produk saja tentunya, nantinya akan menggunakan rest api diambil dari salah satu web marketplace h2h indonesia. jika ada tertarik, silakan apply atau kirim saya pesan untuk diskusi lebih lanjut.",26,Laravel Framework,04/05/2023 06:54:50 WIB,Pembuatan Web Admin Transaksi Ppob
2000000,"hi workers, saya sedang mencari seseorang yang bisa membantu saya membuatkan website manga auto update, yang saya butuhkan yaitu: auto add manga baru auto update chapter baru bisa update dari beberapa sumber (grab dari beberapa situs) file masuk ke database sendiri (hosting) jika ada saran dan masukan bisa info",7,"HTML,Laravel Framework",14/05/2023 21:19:05 WIB,Membuat Web Manga Auto Grab
200000,"mengedit tulisan pada sebuah gambar, saya butuh urgent, jumlah tulisan ada 2 buah",2,"CorelDRAW,Adobe PhotoShop",02/05/2023 07:38:23 WIB,Edit Gambar Sederhana (Urgent)
750000,"selamat pagi saya butuh dibuatkan sistem gps berbasis arduino anda cukup informasikan proses pembuatannya dari awal pembelian alat-alat, perakitan, pemograman, sampai dengan pemasangan di kendaraannya log gps dapat ditelusuri lewat peta leaflet saja karena peta googlemap berbayar",30,"Arduino,Tutorial/Assistant",02/05/2023 07:38:09 WIB,Butuh Dibuatkan Sistem Gps Berbasis Arduino
500000,"halo para worker, mungkin di projects.co.id ada yang memiliki pengalaman untuk membuat alat yang dapat menghitung pengunjung. sebagai contoh:  - https://www.flir.com/products/brickstream-3d-gen2/ - https://www.tdintelligence.com/td2000b-3d/ terima kasih",30,"Python,Machine Learning",02/05/2023 05:39:25 WIB,Butuh Alat Untuk Menghitung Pengunjung
150000,"saya sedang mencari worker yang bisa saya ajak diskusi tentang library tensorflow / opencv android.  silahkan bid bagi yang udh pengalaman pada library tersebut di platform mobile. diskusi via googlemeet, thanks",14,"Java,Android,Android studio",28/04/2023 13:30:16 WIB,Informasi Mengenai Library
1000000,saya sedang mencari seseorang yang ahli dalam mendesain postingan dan story instagram. pekerjaan ini meliputi pembuatan 30 konten hijab dengan konsep yang sudah ada di akun instagram bellascarve.id. keterampilan dalam memahami hijab akan menjadi nilai tambah dalam pengerjaan proyek ini.,7,"Social Media Marketing (SMM),Graphic Design,Logo Design,Adobe PhotoShop,Adobe Illustrator,Web Design,UI Design,UX Design,Social Media",28/04/2023 13:19:20 WIB,Desain & Upload Sosial Media Instagram
100000,dibutuhkan untuk backlink artikel yang berhungan dengan kemasan makanan. artikel sudah ranked oleh google dofollow artikel berhubungan dengan kemasan makanan bisa memposting di media terkenal bisa menjadi pertimbangan ( artikel harus sesuai tema ) mohon bid dengan bertanggung jawab dan infokan jangka waktu penyelesaian pekerjaan tanpa molor.,7,"Internet Marketing,Search Engine Optimization (SEO),Marketing Strategy,Copywriter,Content Writer",27/04/2023 05:48:37 WIB,Dicari Penulis Artikel Untuk Membantu Backlink Artikel Berhubungan Dengan Kemasan Makanan Dan Sudah Ranked Google
5000000,"saya ingin membuat gym management system dengan flutter dan database phpmyadmin dengan data seolah realtime ada 4 model roles dan tampilan  admin dapat mengakses semua menu dan memliki fungsi cms untuk menapilkan promo gambar dll di app member staff, hanya dapat mengakses menu penjualan member dan produk barang serta keperluan lainnya seperti cek in dan out via gr code dan absensi berbasis lokasi dan gambar trainer dapat melihat jumlah murid dan dan jumlah gaji, dengan sistem bagi hasil, serta data member yang berisi ukuran badan member yang dia ajari dan melihat perkembangan  member dengan tampilan yang menarik serta member dapat melihat jumlah sesi latihan dan masa berlaku member, mengisi ukuran tubuh dengan menampilkan grafik menu  member berisi data member paket membership dengan sistem harian, mingguan, bulanan dan tahunan, dengan jumlah sesi latihan, sebagai contoh jika saya membuat 1 bulan dan 20 sesi latihan maka paket hanya berlaku 20 kali sesi latihan dalam sebulan, meskipun masa aktif belum habis maka member harus me renew paket...",30,"PHP,Swift,Android studio,Flutter",08/05/2023 07:07:58 WIB,Gym Management System Dengan Flutter Yang Bisa Di Ios Dan Android Serta Window
1000000,"dibutuhkan freelance yang bisa membuat artikel tentang digital marketing, memiliki kemampuan copywriting dan seo, serta melakukan reach-out client dan membuat dokumen penawaran. pengerjaan 1 bulan membuat 30 artikel. dibutuhkan secepatnya, tinggalkan nomor telfon dan portofolio berupa: artikel seo yang pernah dibuat cerita pengalaman dalam melakukan reach out client contoh dokumen penawaran yang pernah dibuat",30,"Search Engine Optimization (SEO),Marketing Strategy,Copywriter",07/05/2023 23:02:41 WIB,Membuat Artikel Digital Marketing
15000000,"kami membutuhkan freelancer sebagai tenaga pelatih untuk mengajar ui/ux   ketentuan  mengajar 5 hari dalam seminggu  (senin - jumat) 1 hari 3 sesi mengajar, sbb :  sesi pagi 09.00 - 12.00  sesi siang 13.00 - 15.00  sesi sore 17.00 - 20.30  rutin setiap hari hanya untuk yang bisa fulltime  kontrak 3 bulan selama project berlangsung. syarat : pengalaman di bidang kerja atau pengalaman mengajar   memiliki kualifikasi kompetensi yang relevan, yang dibuktikan dengan riwayat pengalaman di bidang yang relevan dengan bidang ui/ux  - memiliki sertifikat kompetensi ui/ux punya akun linkedin dan mau di update untuk disesuaikan dengan profile tenaga pelatih",90,"UI Design,UX Design",12/05/2023 21:28:22 WIB,Tenaga Pelatih Utama Materi Ui/Ux Berpengalaman
1000000,"pembuatan bot scraping untuk auto search , auto click button , auto sent notif via telegram sistem bot dengan python",7,Python,12/05/2023 10:39:18 WIB,Pembuatan Bot Scraping
500000,kami dari perusahaan outsourcing membutuhkan api untuk cek nik-ektp untuk proses penerimaan karyawan di system kami. proses pengecekan apakah  nik pelamar valid atau tidak ? jika valid kami butuh data yang ada tertera di kartu e-ktp termasuk photonya juga untuk mencocokan photo dengan photo sipelamar.,30,"JavaScript,PHP,HTML",16/05/2023 12:50:05 WIB,Butuh Api Untuk Cek Nik- E-Ktp
500000,"saya penjual online butuh seorang input data 20-60 data per hari. data raw ada di line group dengan format order dan akan diinput ke sistem setiap hari. tugas :  - input data customer - input data penjualan closing order jam 21.00, jadi bisa input mulai jam 20.30 atau 20.45 project bulanan.",1,"Administration,Microsoft Excel",16/05/2023 10:44:13 WIB,Input Data Ke Sistem Accounting
500000,"mencari freelancer untuk slicing desain menjadi code flutter. setelah selesai, diharapkan bisa memberi tutor kepada saya terkait cara pengerjaan projectnya. design sudah saya sediakan, durasi pengerjaan 2-3 minggu. silahkan bid dan cantumkan portofolio",14,"Mobile Programming,Flutter",10/05/2023 13:22:02 WIB,Cari Tutor Flutter Serta Slicing Ui Design Menggunakan Flutter
1000000,berikut deskripsi pengerjaannya : -halaman utama untuk tampilkan kategori -ketika kategori di pilih masuk ke pilihan sub kategori -ketika sub kategori di pilih yang berisi tampilan pilihan file pdf jika file blm ada di dalam direktori maka muncul tombol download jika file sudah ada maka tombol download hilang. -ketika file di pilih maka user bisa membaca file tersebut dan di dalamnya tersedia tombol untuk play/pause dan mempercepat/memperlambat scroll ketika membaca file pdf tersebut -data yang didapat dari api nanti akan disimpan ke dalam local storage note : pembuatan menggunakan java native dan api sudah disediakan,7,"Java,Android,Android studio",17/05/2023 14:55:11 WIB,Pembuatan Aplikasi Android Java Native Untuk Membaca File Pdf
180000,memberikan brief untuk: konteks pada content konsep content storyline caption script untuk video content referensi gambar untuk dipakai      3 konten (feeds & reels) dalam 1 minggu     tolong sertakan portfolio!,7,Social Media,17/05/2023 14:42:11 WIB,Social Media Content Specialist / Creative Director
450000,"ikut membantu memberikan training sistem akutansi ini hanya mendampingi saja, bukan mentor utama  paham akan akutansi, diutamakan pernah mengoperasikan sistem akutansi seperti zahir, jurnal id, atau sejenisnya tugasnya selain mendamping saat training, juga membantu dalam diskusi berkaitan dengan coa pekerjaan onsite di jakarta pusat, estimasi lama pekerjaan 3 jam (9-12) fee sudah include all (transportasi dan konsumsi)",1,"Technical Support,Tutorial/Assistant",20/05/2023 06:49:14 WIB,Membantu Training Sistem Akutansi
250000,"find json file from android application (rti bussiness) movers ""top gainers"" and ""top freq""",7,"Database Programming,Android,Data Analysis,API Gateway",19/05/2023 14:02:17 WIB,Inspect Json File Android Application Rti Bussiness
2500000,saya membutuhkan 4 buah video motion grafis untuk video explainer dengan durasi 1 menit tanpa voice over. untuk referensi video bisa cek di link ini  https://youtu.be/ppbmd5mbs5q,14,"Video Editing,Video Production,Video Animation",19/05/2023 13:50:50 WIB,Motion Graphic Untuk Video Explainer
110000,saya membutuhkan freelancer untuk membetulkan error issue pada google shopping ads (google merchant center). antara lain :  website needs improvements account warned for policy violation: incorrect statement account warned for policy violation: incomplete payment project ini hanya untuk freelancer yang terbiasa handle google shopping (merchant). sertakan portfolio anda saat bid. terima kasih,7,"E-Commerce,Google Adwords",05/05/2023 17:05:16 WIB,Membetulkan Error Issue Pada Google Shopping Ads (Google Merchant Center)
1000000,membantu dalam mengembangkan aplikasi ios yang user-friendly untuk pencatatan asuransi. aplikasi ini digunakan untuk memudahkan pengguna dalam mencatat dan mengelola informasi asuransi mereka. kualifikasi yang dibutuhkan:  pengalaman dalam pengembangan aplikasi ios  kemampuan dalam merancang antarmuka pengguna yang menarik dan responsif.  pengalaman dalam mengintegrasikan api ke aplikasi android.  memiliki portofolio yang mencantumkan proyek-proyek sebelumnya yang relevan dengan pengembangan aplikasi ios...,25,"iPhone/iOS,Swift",05/05/2023 09:36:11 WIB,Pembuatan Aplikasi Ios Pencatatan Asuransi
1000000,membantu dalam mengembangkan aplikasi android yang user-friendly untuk pencatatan asuransi. aplikasi ini digunakan untuk memudahkan pengguna dalam mencatat dan mengelola informasi asuransi mereka. kualifikasi yang dibutuhkan:  pengalaman dalam pengembangan aplikasi android menggunakan bahasa pemrograman seperti java atau kotlin.  kemampuan dalam merancang antarmuka pengguna yang menarik dan responsif.  pengalaman dalam mengintegrasikan api ke aplikasi android.  memiliki portofolio yang mencantumkan proyek-proyek sebelumnya yang relevan dengan pengembangan aplikasi android...,25,"Java,Android,Android studio,Kotlin",05/05/2023 09:30:39 WIB,Aplikasi Android Pencatatan Asuransi
500000,"dibutuhkan sebuah ide nama untuk coffee shop beserta logo dengan brand guidelinenya, nama dan logo harus memiliki filosofi, berikan portfolio terbaikmu saat bid.  diutamakan yang bisa memberikan gambaran ide namanya.  lokasi coffee berada di daerah desa cemagi bali(bs cek google). coffee ini berkonsep breakfast, espresso bar dan tempat untuk komunitas surfing. target utama adalah bule",3,"Graphic Design,Logo Design",04/05/2023 06:54:11 WIB,"Name, Logo Dan Brand Guideline"
1000000,tolong untuk melakukan on page dan off page seo untuk website sahamgorengan.com dengan kata kunci 1. rekomendasi saham 2. saham gorengan 3. saham indonesia 4. ihsg hari ini kata kunci harus mencapai page 1 google / top 10 keyword,7,Search Engine Optimization (SEO),14/05/2023 21:18:51 WIB,Website Seo Saham
300000,"improve/tambahkan fitur chat/konsultasi pengacara menggunakan plugins atau sejenisnya jenis konsultasinya berbayar bisa tambahkan kode promo dll. untuk menerima pembayaran menggunakan payment gateway. refrensi : justika.com  informasi : - websitenya sudah berjalan, tinggal di improve - dgn penambahan ini tetap harus mobile friendly dan use friendly ui/ux",3,"PHP,Wordpress,Wordpress Templates",14/05/2023 19:19:22 WIB,Tambah Plugins/Fitur Chat Konsultasi
500000,"selamat malam saya butuh dibuatkan desain tampilan website koi untuk jualan/lelang terkait koi (jasa pembuatan kolam, peralatan/perlengkapan kolam, pakan, obat-obatan dan ikan) silahkan diajukan desain anda",30,"Graphic Design,Website,Web Design,UI Design,UX Design",02/05/2023 05:36:07 WIB,Butuh Dibuatkan Desain Tampilan Website Koi
1000000,saya memerlukan jasa pembuatan 30 video tiktok dengan kriteria sebagai berikut: wanita muslim berhijab yang membuat video tutorial hijab selama 10 hingga 20 detik per video.,7,"Video Editing,Video Production,Video Animation",28/04/2023 13:11:25 WIB,Di Cari Konten Kreator Tiktok
2000000,"pembuatan applikasi bot youtube, ig, tiktok, fb   upload foto profil dan banner input description account/about upload video sekaligus isi title dan descripsi video terjadwal/schedule agar bisa run 24jam support multi account / channel       kesimpulannya kita cukup siapkan bahan bahan yang di perlukan sebelum play app. setelah semua kumplit tool akan jalan upload ke 4 akun tersebut.",14,"JavaScript,.NET Framework,Visual Studio Code",28/04/2023 13:08:39 WIB,Pembuatan Software Desktop
500000,"siang temen2, saya lagi butuh freelancer yang paham photobooth khususnya (dslrbooth) saya ingin custom dan integrasikan payment gateway midtrans/xendit pada aplikasi dslrbooth tasknya : 1. buatkan agar lakukan pembayaran dahulu baru bisa mulai lakukan event/foto * reference dslr booth api  https://support.lumasoft.co/hc/en-us/articles/360000637854-triggers-webhooks-and-api *berikan portofolio/pengalaman yang membuat kami bisa memilih kandidat *cantumkan nomor wa, kami akan filter dalam 5hr kedepan dan yg terpilih bisa mulai start project minggu depan",7,API Gateway,26/04/2023 17:47:05 WIB,Integrasikan Payment Gateway Ke Photobooth/Dslrbooth
100001,"untuk pembuatan backlink ini, ada 2 cara: - bikin artikel baru dan taruh backlink - revisi sedikit artikel yang telah anda tulis dan taruh backlink. kami menerima kedua cara tersebut di atas. silakan ajukan alamat situs mana anda mampu buatkan backlink di tempat tersebut",7,"Search Engine Optimization (SEO),Writing",04/05/2023 12:01:29 WIB,Bikin Backlink Di Situs Media Yang Anda Tulis
4000000,dibutuhkan ilustrator untuk membuat buku ensiklopedia. jadi saya ingin membuat 3 buku ensiklopedia dan materi di dalam nya terdapat 75 tanaman yang harus di ilustrasikan. jadi yang perlu di buat 6 cover buku depan belakang untuk 3 buku dan 75 : 3 buku untuk desain dalam buku. jika memang cocok nanti dibicarakan lebih lanjut. untuk style gambar ada di file. kirim portofolio jika berminat,30,"Adobe PhotoShop,Adobe Illustrator",07/05/2023 17:33:18 WIB,Dibutuhkan Ilustrator Untuk Membuat Buku Ensiklopedia
500000,membuat unit test untuk beberapa project dengan menggunakan bahasa pemrograman go. memastikan sebagian besar code yang telah dibuat dapat di test dengan baik,7,Golang,07/05/2023 16:01:59 WIB,Golang Unit Test
600000,"saya membutuhkan jasa penyebaran, pengumpulan dan penyedia responden pengisi kuesioner tentang kuliah ke taiwan, adapaun hal yang diperhatikan dibawah ini : 1. syarat responden adalah harus lulusan sma/smk sederajat tahun ini atau usia dibawah/ sama dengan 22 tahun  2. syarat responden adalah yang sedang mencari beasiswa kuliah sambil parttime 3. kuesioner di bagi menjadi 2 bagian, mengisi melalui kuesioner langsung kertas dan google form(jumlah kuesioner langsung 100responden, jumlah google form 150responden) 4...",7,"Internet Marketing,Affiliate Marketing,Email Marketing,Social Media Marketing (SMM),Sales and Marketing",07/05/2023 18:55:57 WIB,"Membutuhkan Jasa Penyebaran, Pengumpulan Dan Penyedia Responden Pengisi Kuesioner"
200000,"dear worker selamat siang, saat ini saya sedang mencari tenaga one time support untuk ngebantu saya reinstall outlook dan setup mail di macos versi 13 pekerjaan bisa remote pakai anydesk / teamviewer , dengan catatan : - backup data pst / ost - tidak boleh ada kehilangan, data email pada di macos - email corporate terima kasih",2,"Email Support,Technical Support,Email Handling",12/05/2023 09:51:36 WIB,Reinstall Outlook & Setup Mail At Macos
250000,"survei pel untuk para pelaku usaha baik pedagang, industri, dan pelaku usaha lainnya. survei dilakukan secara offline ke lapangan dibutuhkan data 10 pengusaha sebagai sample",7,Quesioner,12/05/2023 09:16:33 WIB,Survei Pengembangan Ekonomi Lokal (Pel) Surakarta 2023
500000,"need company profile domain udah ada, tinggal design aja landing page : 1. home 2. about us 3. product & services 4. news 5. pricing cantumkan portofolio & bid anda",7,"Website,Web Design,Website Building",16/05/2023 10:41:56 WIB,Web Company Profile
150000,"hi worker, saya ingin dibuatkan logo untuk 2 usaha yaitu laundry kiloan dan jasa setrika kiloan.  saya mau logonya keliatan keren, ga norak dan ga murahan, simple tapi kliatan mewah, orang bisa tau dgn lihat logo itu adlh usaha laindri dan setrika kiloan.  rencana jika cocok, project akan berkelanjutan, utk membuat banner, dan promosi2 lainnya.  silahkan bid dgn harga yg pantas buat saya yg baru mulai usaha kecil2an ini.. thanks",7,"Graphic Design,Logo Design,Adobe Indesign",16/05/2023 09:52:04 WIB,Membuat Logo Usaha Laundri Dan Jasa Setrika
500000,"halo, kami membutuhkan video editor yang berpengalaman untuk untuk membuat konten reels. deskripsi job: butuh 10 video reel dengan masing - masing durasi maksimal 1 menit beserta thumbnail nya. bersedia melakukan revisi jika hasil video belum sesuai. memberikan hasil video tepat waktu sesuai deadline yang diberikan. worker bersedia di arbitrase jika tidak mengikuti ketentuan dari kami. wajib menggunakan software adobe after effects diutamakan bisa berbahasa inggris untuk mengerjakan project ini...",5,"Video Editing,Adobe After Effects,Adobe Premiere,Instagram",27/04/2023 11:10:29 WIB,Butuh Video Editor Untuk Edit Video Reel
4000000,"perusahaan kami sedang mendevelop sebuah project web app untukpengelolaan operasional internal perusahaan dengan fitur2 antara lain ,dashboard monitoring, calender event , management dokument, managementproduksi dan operasional dan lain-lainnya. saaat ini sedang membutuhkantambahan full time freelancer ( fullstack laravel developer ) untukmelakukan beberapa maintenance list di web app backend kami. lebihdetailnya akan disampaikan pada freelancer yg qualified. silahkan kirimresume ada",40,"JavaScript,PHP,HTML,CSS,Laravel Framework,VueJS",10/05/2023 11:24:28 WIB,Dicari Full Time Freelancer Fullstack Laravel Developer
4500000,"saya membutuhkan freelancer yang terbiasa mengajar ui/ux designer mengajar 5 hari dalam seminggu (senin - jumat)  1 hari 3 sesi  mengajar, sbb :  09.00 - 12.00  13.00 - 15.00  17.00 - 20.30  rutin setiap hari hanya untuk yang bisa fulltime  kontrak selama project berlangsung.  syarat : pengalaman di bidang mengajar  pengalaman ui/ux punya akun linkedin dan mau di update punya srtifikat mengenai ui/ux atau yg relevan",20,"UI Design,UX Design",10/05/2023 10:07:02 WIB,Pengajar Ui/Ux Designer
125000,"halo kak, saya mau menawarkan proyek untuk deploy flask application ke vps, jika ada yang pernah mencoba, silahkan ambil proyek ini.sebelumnya saya sudah coba, tapi terdapat error tensorflow seperti gambar terlampir. terima kasih",2,"Python,Website,Flask Python,Nginx",10/05/2023 09:35:47 WIB,Error Tensorflow Saat Deploy Flask Website Ke Vps Ubuntu
500000,"kami, brand skincare, sedang membutuhkan professional photos menggunakan talent pria dengan tema 'career man/businessman/enterpreneur'. kami hanya memerlukan 5 foto saja. kriteria talent : 1). cowok, usia 28-35 2). fotogenik, manly, tinggi dan gagah. gallant man 3). wajah bersih sehat dan tidak ada masalah kulit wajah 4) tidak bertato lokasi disesuaikan dengan tema. budget sesuai dengan penawaran. contoh fotonya kami sertakan di attachment ya. bagi yang berminat silahkan bid dan drop your portofolios...",15,Photography,17/05/2023 14:41:08 WIB,Foto Model Cowok Professional Tema 'Enterpreneur'
1000000,"butuh video animasi untuk explanation video usaha catering dengan durasi 1-2 menit, semua teks sama flownya sudah ada tinggal diikutin aja. silahkan kirim portfolio video animasi yang pernah dikerjakan. jika belum berpengalaman, mohon jangan bid ya. terima kasih.",5,"Animation,3D Animation,Video Editing,Video Production,Video Animation",17/05/2023 14:00:40 WIB,Video Animasi 1-2 Menit
1500000,"hallo, sya ingin membuat aplikasi / website sederhana  untuk saya bisa merubah setiap lagu menjadi artis lain yang menyanyikan nya  hanya dengan cara mengupload mp3 nya lalu suara vocal berubah.. contoh sya mengupload lagu seventeen namun di nyanyikan aril noah jika membuat aplikasi / website sangat lama.. sya mau cri jasa aja.. saya kirim file mp3 nya dan di ubah jadi suara artis2 indonesia  seperti aril / seventeen",7,Artificial Intelligence,17/05/2023 12:51:26 WIB,Technology Ai Song Cover
350000,"saya membutuhkan worker yang berpengalaman untuk melakukan set up awal campaign google ads. campaign yang akan dijalankan adalah search ads , dan remarketing . - set up ga4, tracking goals - riset keyword, kompetitor - optimasi bidding - penulisan ad copy - reporting diutamakan domisili jakarta / tangerang. sertakan portofolio, nomer wa dan link profil linkedin anda saat melakukan bid.",7,Google Adwords,09/05/2023 15:39:38 WIB,Set Up Campaign Google Ads
500000,"halo teman2 projectid, saat ini saya ada kendala upgrade versi php di web laravel, batasannya upgrade php v7 ke v8.1 sampai website bisa di akses kembali.",7,Laravel Framework,19/05/2023 10:55:34 WIB,Memperbaiki Error Upgrade Versi Php Di Web Laravel
200000,"halo, saya membutuhkan penulis artikel tentang negara taiwan, tapi dengan syarat : 1. menjelaskan tentang tempat-tempat wisata di taiwan 2. menjelaskan tempat kuliner yang unik di taiwan 3. menjelaskan kebudayaan dan kebiasaan unik 4. menjelaskan peluang beasiswa ke taiwan 5. syarat untuk kuliah ketaiwan total tulisan yang saya butuhkan sangat bervariasi dengan panjang antara 600-2000 kata hal yang harus diperhatikan - tulisan santai tapi tidak selengean -artikel dapat dibaca dengan mudah -disertai dengan gambar setiap artikel - tulisan sepenuhnya menjadi tanggung jawab penulis",7,"Writing,Blog,Blogspot",05/05/2023 08:54:31 WIB,Membutuhkan Penulis Semua Yang Berhubungan Dengan Negara Taiwan
500000,"dear freelancer,  saya sedang butuh orang untuk menyelesaikan course trailhead dengan kualifikasi berikut:  fluent in english dapat memenuhi target 300k points dengan deadline 31 july 2023 memiliki laptop dan hp yang proper untuk online course mengerti it, khususnya salesforce product (marketing/sales/industrial cloud), slack , mulesoft , tableau project overview:  course akan memberikan article (english 1-3 halaman) dan setiap akhir article akan memberikan quiz (2-3 pertanyaan)  kalian perlu membaca article dan mengisi quiz dengan benar  tiap article memiliki points dan jika salah menjawab point akan berkurang  average points tiap article -+ 1k points...",45,"English,Content Management System (CMS),Integration,Data Analysis,API Gateway",04/05/2023 22:09:13 WIB,Penyelesaian Courses Trailhead
